title,year,citationCount,top_conf_citations,top_journal_citations,paperId,notes,citations_2014,citations_2015,citations_2016,citations_2017,citations_2018,citations_2019,citations_2020,citations_2021,citations_2022,citations_2023,citations_2024,ai_category
"Show, Don’t Tell: Demonstrations Outperform Descriptions for Schema-Guided Task-Oriented Dialogue",2022,27,15,0,a07fead63ca30fcd708f66de173c70f40262817c,,0,0,0,0,0,0,0,0,5,13,6,自然语言处理
Does Pre-training Induce Systematic Inference? How Masked Language Models Acquire Commonsense Knowledge,2022,9,2,0,0b483b550b21ec42d693fc04a372dbb10dd07019,,0,0,0,0,0,0,0,0,2,3,2,自然语言处理
Using Paraphrases to Study Properties of Contextual Embeddings,2022,4,1,0,c25bd2ded301e9c501d9d08428087f6e05cf4b0d,,0,0,0,0,0,0,0,0,0,2,2,自然语言处理
Measure and Improve Robustness in NLP Models: A Survey,2022,155,53,2,f91dbd39d4c742ba675e447b04a0b0c70b33e836,,0,0,0,0,0,0,1,0,18,69,34,自然语言处理
Learning to Generate Examples for Semantic Processing Tasks,2022,4,0,0,3c9a3419d2eeefa8a4d0390839cff773dbc27fca,,0,0,0,0,0,0,0,0,0,0,1,自然语言处理
Symbolic Knowledge Distillation: from General Language Models to Commonsense Models,2022,355,156,3,521ccc898395a2818fced22b4cf371b0e5121f94,,0,0,0,0,0,0,0,7,64,111,110,自然语言处理
GenIE: Generative Information Extraction,2022,82,24,2,df4d715898e04038a3a367b977fe82e479dcb291,,0,0,0,0,0,0,0,0,10,26,20,自然语言处理
Entity Linking via Explicit Mention-Mention Coreference Modeling,2022,35,14,0,5f0ae683ecdb37762f04c3a340d6cf8448512ce1,,0,0,0,0,0,0,0,1,2,10,14,自然语言处理
Massive-scale Decoding for Text Generation using Lattices,2022,8,7,0,4614acf4d5657d634b0654b06fe84a637f44606f,,0,0,0,0,0,0,0,0,3,4,1,自然语言处理
Disentangling Indirect Answers to Yes-No Questions in Real Conversations,2022,7,4,0,6c47b6dfb04f81ed6898633a08111303fe912f4a,,0,0,0,0,0,0,0,0,0,3,2,自然语言处理
Quantifying Adaptability in Pre-trained Language Models with 500 Tasks,2022,17,6,0,40b4d98588719407fb72a014ab79e4145695654b,,0,0,0,0,0,0,0,0,3,11,2,自然语言处理
Counterfactually Augmented Data and Unintended Bias: The Case of Sexism and Hate Speech Detection,2022,19,5,1,3597d42ed900c7c49a2267bcfe7a8acc0c1f4e0c,,0,0,0,0,0,0,0,0,3,10,4,模型可解释性、公平性、应用系统等
A Study of the Attention Abnormality in Trojaned BERTs,2022,65,23,1,2b843ad9fa9baa7ac0e0ef43fa5e97533e6210ce,,0,0,0,0,0,0,0,0,4,11,38,模型可解释性、公平性、应用系统等
EPiDA: An Easy Plug-in Data Augmentation Framework for High Performance Text Classification,2022,13,5,2,bc256ed6c51d0565442ab765f6c1f00612e10523,,0,0,0,0,0,0,0,0,3,2,4,自然语言处理
"Partial-input baselines show that NLI models can ignore context, but they don’t.",2022,4,1,0,b185b59806eeee55cdaca1a3f7181c4c5d3604af,,0,0,0,0,0,0,0,0,0,1,3,自然语言处理
Lifelong Pretraining: Continually Adapting Language Models to Emerging Corpora,2022,131,55,1,ed8931af08ce757a92a01ed43a0619522e10e8ff,,0,0,0,0,0,0,0,3,24,36,36,自然语言处理
Learning as Conversation: Dialogue Systems Reinforced for Information Acquisition,2022,6,2,1,ea6b152a07dcd2e4ff6c4646d8efe1314346793c,,0,0,0,0,0,0,0,0,1,5,0,自然语言处理
Dynamic Programming in Rank Space: Scaling Structured Inference with Low-Rank HMMs and PCFGs,2022,10,7,0,10e34d4fdc61df48e7da7c0a14889fbbb17483d5,,0,0,0,0,0,0,0,0,1,4,3,概率统计与推理基础
What Factors Should Paper-Reviewer Assignments Rely On? Community Perspectives on Issues and Ideals in Conference Peer-Review,2022,8,2,0,cc9f179934e0c9d092ce89ee43e1467dbb2306f0,,0,0,0,0,0,0,0,0,1,5,2,模型可解释性、公平性、应用系统等
Reducing Disambiguation Biases in NMT by Leveraging Explicit Word Sense Information,2022,7,5,0,f05fb82401162a79c9a6a608907fdf4670c8b2e6,,0,0,0,0,0,0,0,0,0,4,2,自然语言处理
Mining Clues from Incomplete Utterance: A Query-enhanced Network for Incomplete Utterance Rewriting,2022,16,9,0,caf452575e4c9a2bbd5b77be2a17ab6d81fa060d,,0,0,0,0,0,0,0,0,0,9,4,自然语言处理
Domain-Oriented Prefix-Tuning: Towards Efficient and Generalizable Fine-tuning for Zero-Shot Dialogue Summarization,2022,21,12,0,5ecc001af7dcfde1a9eb0b7e96ea4ea1fb9631e5,,0,0,0,0,0,0,0,1,3,9,6,自然语言处理
Interactive Symbol Grounding with Complex Referential Expressions,2022,4,1,0,ef8b2b46f564779c18596c3bf79bef1f93d4a72c,,0,0,0,0,0,0,0,0,0,2,2,自然语言处理
Generalized Quantifiers as a Source of Error in Multilingual NLU Benchmarks,2022,16,5,1,03d73f3073ac0d73d60d5567fc1ed558367c8279,,0,0,0,0,0,0,0,0,3,4,6,自然语言处理
Exact Paired-Permutation Testing for Structured Test Statistics,2022,6,3,0,631910c820c905cd0ed71b787e1d0d049b38f6ae,,0,0,0,0,0,0,0,0,0,2,1,概率统计与推理基础
A Balanced Data Approach for Evaluating Cross-Lingual Transfer: Mapping the Linguistic Blood Bank,2022,27,10,0,0c158af75176a98cafa8507b76c67beaf80119a7,,0,0,0,0,0,0,0,0,4,6,11,自然语言处理
SSEGCN: Syntactic and Semantic Enhanced Graph Convolutional Network for Aspect-based Sentiment Analysis,2022,121,21,7,7276ba18dbb89a1b360f03470ef9c02f53bb62e4,,0,0,0,0,0,0,0,1,4,22,49,自然语言处理
Mitigating Toxic Degeneration with Empathetic Data: Exploring the Relationship Between Toxicity and Empathy,2022,15,3,0,b1d2ef3554859c804d9b7993b83c90385717793f,,0,0,0,0,0,0,0,0,2,6,3,自然语言处理
DUCK: Rumour Detection on Social Media by Modelling User and Comment Propagation Networks,2022,38,11,1,6853c273860838a9e41e48c24fc5968c31f21a9e,,0,0,0,0,0,0,0,0,0,11,16,自然语言处理
Jam or Cream First? Modeling Ambiguity in Neural Machine Translation with SCONES,2022,12,6,1,a035c83d38885ae389672b9e9c2d9f3e9fd63564,,0,0,0,0,0,0,0,0,4,3,4,自然语言处理
SkillSpan: Hard and Soft Skill Extraction from English Job Postings,2022,68,7,3,0b2a24ab36d9b30c2dc2472421ffa02a5a25b2a4,,0,0,0,0,0,0,0,0,6,7,31,自然语言处理
RAAT: Relation-Augmented Attention Transformer for Relation Modeling in Document-Level Event Extraction,2022,33,10,1,c9e0f9ac2c7ad1518a100faca0c2da9577b915fd,,0,0,0,0,0,0,0,0,0,10,17,自然语言处理
A Double-Graph Based Framework for Frame Semantic Parsing,2022,14,7,1,1667ba5fb663205ae54cd6a5fb07036724e35d8e,,0,0,0,0,0,0,0,0,2,6,2,自然语言处理
An Enhanced Span-based Decomposition Method for Few-Shot Sequence Labeling,2022,70,23,3,26b2da6edde23167e5d62a2e74c42c681d9bd2fc,,0,0,0,0,0,0,0,0,8,23,18,自然语言处理
A Two-Stream AMR-enhanced Model for Document-level Event Argument Extraction,2022,56,23,2,5037621e03bafa4a069eafe3561af16e08338680,,0,0,0,0,0,0,0,0,2,12,26,自然语言处理
Robust (Controlled) Table-to-Text Generation with Structure-Aware Equivariance Learning,2022,56,25,0,47b23ebaeb60184569c22aa484167bc32f914fe3,,0,0,0,0,0,0,1,0,9,17,16,自然语言处理
JointLK: Joint Reasoning with Language Models and Knowledge Graphs for Commonsense Question Answering,2022,83,27,1,83c4b8fcef3c214cfae45818a5b4b637372f3083,,0,0,0,0,0,0,0,0,9,21,34,自然语言处理
Models In a Spelling Bee: Language Models Implicitly Learn the Character Composition of Tokens,2022,22,8,1,937b177d2ed7cee27ee45300c690f2f60c81bae5,,0,0,0,0,0,0,0,3,4,4,5,自然语言处理
A Corpus for Understanding and Generating Moral Stories,2022,15,6,0,272b389c94b9592dc50875444e8816e545c4a6a9,,0,0,0,0,0,0,0,0,1,1,3,自然语言处理
Modeling Multi-Granularity Hierarchical Features for Relation Extraction,2022,12,2,1,18d85088e8f79ae0fea00772ac346f76780e9b03,,0,0,0,0,0,0,0,0,0,5,5,自然语言处理
Cross-modal Contrastive Learning for Speech Translation,2022,102,71,0,1b6ceca12ca51c86f324d469914d1e2e0bcca884,,0,0,0,0,0,0,0,0,11,43,25,多模态学习
Meet Your Favorite Character: Open-domain Chatbot Mimicking Fictional Characters with only a Few Utterances,2022,42,19,0,aab1dead436211a7d9eb7a717ee63a5d23cf23f0,,0,0,0,0,0,0,0,0,3,10,21,自然语言处理
DynamicTOC: Persona-based Table of Contents for Consumption of Long Documents,2022,1,0,0,dd276ba0d38ef4a18c32448d1b9073ad93463e1d,,0,0,0,0,0,0,0,0,0,1,0,自然语言处理
KALA: Knowledge-Augmented Language Model Adaptation,2022,40,13,3,6ae63be462816bdd0da32894985d16f1e8cbdd5c,,0,0,0,0,0,0,0,0,5,15,10,自然语言处理
On the Effect of Pretraining Corpora on In-context Learning by a Large-scale Language Model,2022,104,43,1,1fafaccebc4a74898a74c606f846318c4c2c7536,,0,0,0,0,0,0,0,0,14,39,30,自然语言处理
Sketching as a Tool for Understanding and Accelerating Self-attention for Long Sequences,2022,6,2,0,a68ab49816d5729435c3d994b434c75c6f162da0,,0,0,0,0,0,0,0,1,0,1,2,机器学习（含深度学习）
Partner Personas Generation for Dialogue Response Generation,2022,17,8,0,26cf6d2e72821471597cc9e6d664b5a946b20fb1,,0,0,0,0,0,0,0,0,0,6,5,自然语言处理
Semantically Informed Slang Interpretation,2022,8,3,0,13d05ab75443c1d3230a16dc4b0b8da77e6d95ee,,0,0,0,0,0,0,0,0,1,1,3,自然语言处理
Dual-Channel Evidence Fusion for Fact Verification over Texts and Tables,2022,20,7,0,bb3c30ca4ad74a47cb10ae20345efeb26082f721,,0,0,0,0,0,0,0,0,0,4,11,多模态学习
TreeMix: Compositional Constituency-based Data Augmentation for Natural Language Understanding,2022,26,9,0,e184d1113060bbeec171b2faf0db0a4022515859,,0,0,0,0,0,0,0,0,7,9,7,自然语言处理
Syn2Vec: Synset Colexification Graphs for Lexical Semantic Similarity,2022,9,1,0,88fc8581db943ba1e64b2cceccd8f047883fd65d,,0,0,0,0,0,0,0,0,1,6,2,自然语言处理
On the Origin of Hallucinations in Conversational Models: Is it the Datasets or the Models?,2022,218,71,8,e9f28c98a00766e484810598886cf48b0de66cfa,,0,0,0,0,0,0,0,1,11,84,81,自然语言处理
Is “My Favorite New Movie” My Favorite Movie? Probing the Understanding of Recursive Noun Phrases,2022,5,1,0,08be84ef68d4567ec6be58dc9326f7ec2d68f36d,,0,0,0,0,0,0,0,0,2,0,2,自然语言处理
Original or Translated? A Causal Analysis of the Impact of Translationese on Machine Translation Performance,2022,15,9,0,c64c49571cea94efb31fab21ef255b2d4cecf707,,0,0,0,0,0,0,0,0,2,6,5,自然语言处理
Visual Commonsense in Pretrained Unimodal and Multimodal Models,2022,43,21,0,7e69986581d477f7051bb77ba1ba30e04e38ad8b,,0,0,0,0,0,0,0,0,11,13,14,多模态学习
"QuALITY: Question Answering with Long Input Texts, Yes!",2022,184,51,1,3c209e0703ffff26231b1145268c935df494631a,,0,0,0,0,0,0,0,3,21,33,60,自然语言处理
ExSum: From Local Explanations to Model Understanding,2022,26,3,1,df523b4f55989854909fd3343f5e07258bd5bdba,,0,0,0,0,0,0,1,1,9,7,8,模型可解释性、公平性、应用系统等
Maximum Bayes Smatch Ensemble Distillation for AMR Parsing,2022,38,11,1,74cc368e343284e81430700e1dab7144984084a0,,0,0,0,0,0,0,0,1,3,12,15,自然语言处理
When Does Syntax Mediate Neural Language Model Performance? Evidence from Dropout Probes,2022,12,3,2,2b144c53f24531170f4d3f902ec094b2db144fee,,0,0,0,0,0,0,0,0,2,5,4,自然语言处理
Modeling Task Interactions in Document-Level Joint Entity and Relation Extraction,2022,10,4,0,a93c42672af584f12c953296918aac7827c0b8b9,,0,0,0,0,0,0,0,0,1,3,2,自然语言处理
Few-Shot Semantic Parsing with Language Models Trained on Code,2022,72,29,1,6e8f8e2d2c73c91d1c9198eb802f1c64b860ea4a,,0,0,0,0,0,0,0,0,17,30,14,自然语言处理
CORWA: A Citation-Oriented Related Work Annotation Dataset,2022,22,7,0,834192cf3f0c0dfe28b7c6ba33893eaeb760c6dc,,0,0,0,0,0,0,0,0,1,4,12,自然语言处理
Overcoming Catastrophic Forgetting During Domain Adaptation of Seq2seq Language Generation,2022,57,16,0,dde0be499b277f52dc3a730e90005c6c19a049cb,,0,0,0,0,0,0,2,0,9,9,21,自然语言处理
Extreme Zero-Shot Learning for Extreme Text Classification,2022,30,12,0,2682e65610453726cef1d23aae4aaed2e043fbb2,,0,0,0,0,0,0,0,0,5,9,9,自然语言处理
ConfliBERT: A Pre-trained Language Model for Political Conflict and Violence,2022,39,9,2,9b05db2352c046b3b29bd9bf258cda8895d96d31,,0,0,0,0,0,0,0,0,5,14,14,自然语言处理
Automatic Multi-Label Prompting: Simple and Interpretable Few-Shot Classification,2022,13,6,1,b0f915c8e33afdf3829af71f189ddc34077dcc8e,,0,0,0,0,0,0,0,0,2,7,1,自然语言处理
Few-shot Subgoal Planning with Language Models,2022,27,13,0,ba6ff2c50862a6be18d1c610d1fadc751fd6d8e7,,0,0,0,0,0,0,0,0,4,13,7,自然语言处理
IDPG: An Instance-Dependent Prompt Generation Method,2022,68,34,0,a7b92f9c62cdf35c37d9ccdb20e43807eb86900a,,0,0,0,0,0,0,0,0,10,25,19,自然语言处理
Embedding Hallucination for Few-shot Language Fine-tuning,2022,4,2,0,e89f3d2a3aad78ea21955c0eb46bc1a9d9ca1aa9,,0,0,0,0,0,0,0,0,0,0,3,自然语言处理
"Cryptocurrency Bubble Detection: A New Stock Market Dataset, Financial Task & Hyperbolic Models",2022,23,2,1,e16b7790e22a20ac86be0976069ef6ffaa2e35ec,,0,0,0,0,0,0,0,0,3,14,3,表示学习与优化方法
Nearest Neighbor Knowledge Distillation for Neural Machine Translation,2022,13,8,0,a555c9b700e72d7e43528c0af8ed683ef816c002,,0,0,0,0,0,0,0,0,0,10,3,自然语言处理
DEMix Layers: Disentangling Domains for Modular Language Modeling,2022,159,49,1,917c63f2186119166b3379f5d2816bb1a2f39b09,,0,0,0,0,0,0,0,6,27,42,47,自然语言处理
Contrastive Learning for Prompt-based Few-shot Language Learners,2022,39,22,0,139bfd354431c4541004c5de5052a63e1f94130e,,0,0,0,0,0,0,0,0,8,8,14,自然语言处理
Cross-Lingual Event Detection via Optimized Adversarial Training,2022,26,13,0,8810f63ddbfa775c2182a6cd55d4322a8875868a,,0,0,0,0,0,0,0,0,6,10,7,自然语言处理
Identifying Implicitly Abusive Remarks about Identity Groups using a Linguistically Informed Approach,2022,16,9,0,60864e37661aecf37a3b8862c20c43f4912d739d,,0,0,0,0,0,0,0,0,0,8,3,自然语言处理
Label Definitions Improve Semantic Role Labeling,2022,5,3,0,e7ac9ea2ae42a7a9125da69de1ff295efebfaff5,,0,0,0,0,0,0,0,0,1,3,0,自然语言处理
Shedding New Light on the Language of the Dark Web,2022,23,9,2,a40866d517e511b9a54b0a43e6f27a67a379c24c,,0,0,0,0,0,0,0,0,0,5,7,自然语言处理
Conceptualizing Treatment Leakage in Text-based Causal Inference,2022,16,1,0,109ce3933cefd16d582e184f376e42f02dc9b78c,,0,0,0,0,0,0,1,0,0,1,7,自然语言处理
Consistency Training with Virtual Adversarial Discrete Perturbation,2022,15,5,0,457e73be2f876e0b838f0f8d7aa921993b7f607d,,0,0,0,0,0,0,0,3,4,3,5,机器学习（含深度学习）
CONFIT: Toward Faithful Dialogue Summarization with Linguistically-Informed Contrastive Fine-tuning,2022,70,26,2,1acdb41d8a17cff5593495410a7d4b9f44972a82,,0,0,0,0,0,0,0,1,17,30,11,自然语言处理
CoMPM: Context Modeling with Speaker’s Pre-trained Memory Tracking for Emotion Recognition in Conversation,2022,91,27,3,a721c59f1259b3aee07fda758e131718dd9ec945,,0,0,0,0,0,0,0,1,6,31,34,自然语言处理
Investigating Crowdsourcing Protocols for Evaluating the Factual Consistency of Summaries,2022,25,12,0,a3d23324b894f850ae83285a28939166c585fdda,,0,0,0,0,0,0,0,3,5,6,5,自然语言处理
DialSummEval: Revisiting Summarization Evaluation for Dialogues,2022,42,20,0,35f38cfde36ab86ba4400e73cc3f8b22bba31458,,0,0,0,0,0,0,0,0,4,11,15,自然语言处理
Hyperbolic Relevance Matching for Neural Keyphrase Extraction,2022,19,4,0,64452abf42e272b64a45c9469775b728a72c6157,,0,0,0,0,0,0,0,0,3,9,4,自然语言处理
Template-free Prompt Tuning for Few-shot NER,2022,196,60,11,1dd344ce28f1e5a078f9d8396b5078388e555d99,,0,0,0,0,0,0,0,5,36,59,61,自然语言处理
Few-Shot Document-Level Relation Extraction,2022,16,5,0,b94df0e6f2ef3f3e7ce635abf5eeda02b4036cef,,0,0,0,0,0,0,0,0,2,4,6,自然语言处理
LaMemo: Language Modeling with Look-Ahead Memory,2022,3,2,0,a99cbe3d7b2e201491a2fa1f4ba57b1e80cca3a3,,0,0,0,0,0,0,0,0,1,1,0,自然语言处理
Exploiting Inductive Bias in Transformers for Unsupervised Disentanglement of Syntax and Semantics with VAEs,2022,2,1,0,3771ac4627688982dde029d03a2a8d9026a78a25,,0,0,0,0,0,0,0,0,0,1,1,自然语言处理
Neighbors Are Not Strangers: Improving Non-Autoregressive Translation under Low-Frequency Lexical Constraints,2022,7,4,0,a4b9466175991ca0219970d50438bd4a938476ce,,0,0,0,0,0,0,0,0,3,3,1,自然语言处理
What do Toothbrushes do in the Kitchen? How Transformers Think our World is Structured,2022,6,1,0,682ee9c06f3eff3e3708b4d0419dc85ecf9c6c87,,0,0,0,0,0,0,0,0,2,3,1,自然语言处理
Less is More: Learning to Refine Dialogue History for Personalized Dialogue Generation,2022,72,19,2,4f5c1903989d2da1a9ef0cef566516860407774e,,0,0,0,0,0,0,0,0,2,21,25,自然语言处理
A Holistic Framework for Analyzing the COVID-19 Vaccine Debate,2022,31,13,0,4a8f355f2e0037db623d36928111b7b3df7a9bcd,,0,0,0,0,0,0,0,0,3,11,11,自然语言处理
Learning to Win Lottery Tickets in BERT Transfer via Task-agnostic Mask Training,2022,12,6,0,fb6f862dd56706db84357b7c616bc3b0fd37cbab,,0,0,0,0,0,0,0,0,2,4,5,机器学习（含深度学习）
You Don’t Know My Favorite Color: Preventing Dialogue Representations from Revealing Speakers’ Private Personas,2022,23,8,0,56dd18076f6323ab50030871ae2fc374a48077e5,,0,0,0,0,0,0,0,0,0,9,8,自然语言处理
Explaining Dialogue Evaluation Metrics using Adversarial Behavioral Analysis,2022,10,5,0,3defa61ebaecdb330efffe67593c57c35b28d72d,,0,0,0,0,0,0,0,0,1,4,3,模型可解释性、公平性、应用系统等
Annotators with Attitudes: How Annotator Beliefs And Identities Bias Toxic Language Detection,2022,322,134,9,cf3cfb90a6d8c431dc8a7f115b011d5ffbb439ee,,0,0,0,0,0,0,0,5,47,96,90,自然语言处理
Non-Autoregressive Chinese ASR Error Correction with Phonological Training,2022,10,4,0,a55a3e5ef5ae5004d9f03bb67e1a577d95274272,,0,0,0,0,0,0,0,0,2,1,5,自然语言处理
Hate Speech and Counter Speech Detection: Conversational Context Does Matter,2022,52,21,1,cef202f9875ac33afd9c4ed7e3b93ca0870486fd,,0,0,0,0,0,0,0,0,1,16,21,自然语言处理
DACSA: A large-scale Dataset for Automatic summarization of Catalan and Spanish newspaper Articles,2022,10,4,1,42bf54a1bfd86739b62ddbafe14e12152746c382,,0,0,0,0,0,0,0,0,2,1,4,自然语言处理
Time Waits for No One! Analysis and Challenges of Temporal Misalignment,2022,102,44,3,17d7fd18123e12efbb9c255c8b986a5e84578b07,,0,0,0,0,0,0,0,3,20,29,26,基础 AI 理论
MCSE: Multimodal Contrastive Learning of Sentence Embeddings,2022,41,14,1,fb5273032ab997dddd1b2917ed41808fd66fb909,,0,0,0,0,0,0,0,0,5,20,9,多模态学习
HiURE: Hierarchical Exemplar Contrastive Learning for Unsupervised Relation Extraction,2022,43,23,0,46f1970b3c09b613494c81ea43614ff0a4197237,,0,0,0,0,0,0,0,0,8,21,10,表示学习与优化方法
Diagnosing Vision-and-Language Navigation: What Really Matters,2022,54,21,1,ac41d132999661f6b59db46a28086d4b6707654a,,0,0,0,0,0,0,0,4,17,12,12,多模态学习
Aligning to Social Norms and Values in Interactive Narratives,2022,52,21,3,871037ca207f36ffc5322d7815a2dd58951a6227,,0,0,0,0,0,0,0,1,8,14,19,自然语言处理
"MOVER: Mask, Over-generate and Rank for Hyperbole Generation",2022,16,9,0,ed067486b5dc3ef7f70ee32d282a11541e7faa1e,,0,0,0,0,0,0,0,0,1,9,4,自然语言处理
Embarrassingly Simple Performance Prediction for Abductive Natural Language Inference,2022,4,0,0,94d05ed2d95713ec36779bf3d5e978642e45bf93,,0,0,0,0,0,0,0,0,0,2,0,自然语言处理
Re-Examining System-Level Correlations of Automatic Summarization Evaluation Metrics,2022,49,16,1,9a2a11cd49434a30dbaba8430886cd83258d1e45,,0,0,0,0,0,0,0,0,12,13,18,自然语言处理
Proceedings of the 2024 Conference of the North American Chapter of the Association for Computational Linguistics: Human Language Technologies (Volume 1: Long Papers),2024,0,0,0,dd9f8e588036574b8a5587f7ef4b31940ab1a4a1,,0,0,0,0,0,0,0,0,0,0,0,自然语言处理
Named Entity Recognition Under Domain Shift via Metric Learning for Life Sciences,2024,3,0,0,676fcd2ca5419fa17251230abaef84ec70618e94,,0,0,0,0,0,0,0,0,0,0,1,自然语言处理
Text Diffusion Model with Encoder-Decoder Transformers for Sequence-to-Sequence Generation,2024,16,7,1,47e40c4c8d291f6d326ccef7313aba7d98dbf283,,0,0,0,0,0,0,0,0,0,0,5,自然语言处理
An Interactive Framework for Profiling News Media Sources,2024,5,4,0,7adc93b4e1423fbe092e5ded2b932d27b376f8c7,,0,0,0,0,0,0,0,0,0,0,4,自然语言处理
Assessing Logical Puzzle Solving in Large Language Models: Insights from a Minesweeper Case Study,2024,17,6,0,69581fa1f7eacad35d8528c7f8527ed27a6f94c1,,0,0,0,0,0,0,0,0,0,0,5,基础 AI 理论
TelME: Teacher-leading Multimodal Fusion Network for Emotion Recognition in Conversation,2024,25,5,1,fc47b02c2df4fba11dc8355c46455d6100a92cb1,,0,0,0,0,0,0,0,0,1,0,2,多模态学习
Effective and Efficient Conversation Retrieval for Dialogue State Tracking with Implicit Text Summaries,2024,6,1,0,59de4703ca458ed416fbf9aa7219658e94aef9bc,,0,0,0,0,0,0,0,0,0,0,1,自然语言处理
Promptly Predicting Structures: The Return of Inference,2024,6,2,0,27494f35c4e3f31c5fb9e18ad289144ec0532373,,0,0,0,0,0,0,0,0,0,0,3,概率统计与推理基础
On Linearizing Structured Data in Encoder-Decoder Language Models: Insights from Text-to-SQL,2024,3,2,0,80239c45d67d7616cc341c16e5cbd456eccca302,,0,0,0,0,0,0,0,0,0,0,0,自然语言处理
Extractive Summarization with Text Generator,2024,0,0,0,3f39e703f522f45d6b3de76a7d373679826602d6,,0,0,0,0,0,0,0,0,0,0,0,自然语言处理
Self-generated Replay Memories for Continual Neural Machine Translation,2024,5,1,0,dc368b5bc1887574291380ed66c8c42b77d199e3,,0,0,0,0,0,0,0,0,0,0,1,自然语言处理
Measuring and Improving Chain-of-Thought Reasoning in Vision-Language Models,2024,40,9,0,280353fd7a7a3e49c415c443e1b7ccf7de9c2b4e,,0,0,0,0,0,0,0,0,0,5,14,多模态学习
Building Knowledge-Guided Lexica to Model Cultural Variation,2024,11,3,0,a67c8f49509e81656651a221bac5b1b87a6291f5,,0,0,0,0,0,0,0,0,0,0,5,自然语言处理
Adaptive Rank Selections for Low-Rank Approximation of Language Models,2024,16,5,0,01cbb338f1acbdc94e5425b811ae6df0737baac6,,0,0,0,0,0,0,0,0,0,1,1,自然语言处理
An Empirical Study of Consistency Regularization for End-to-End Speech-to-Text Translation,2024,7,3,0,486aa9501bf3a42a7c5c8871f92e6285408d1d46,,0,0,0,0,0,0,0,0,0,0,2,自然语言处理
Unleashing the Emergent Cognitive Synergy in Large Language Models: A Task-Solving Agent through Multi-Persona Self-Collaboration,2024,226,30,6,434b9f9bc71c935e4a46a1aff36a8cc4c22d9afa,,0,0,0,0,0,0,0,0,0,23,64,自然语言处理
FPT: Feature Prompt Tuning for Few-shot Readability Assessment,2024,1,0,0,e51b19f1465e9ddbfd3883696ad49dcf2bc671b2,,0,0,0,0,0,0,0,0,0,0,0,自然语言处理
Head-to-Tail: How Knowledgeable are Large Language Models (LLMs)? A.K.A. Will LLMs Replace Knowledge Graphs?,2024,185,45,0,fb00016c1e048b9373803add001c1ec7e877cb23,,0,0,0,0,0,0,0,0,0,30,81,自然语言处理
kNN-ICL: Compositional Task-Oriented Parsing Generalization with Nearest Neighbor In-Context Learning,2024,11,2,0,218a9c9f836e31be1e71ba50728d24a478ebcddd,,0,0,0,0,0,0,0,0,0,2,4,自然语言处理
ARES: An Automated Evaluation Framework for Retrieval-Augmented Generation Systems,2024,186,56,5,4df2b1e7d54fe5ad81dc2ed6774b93ef7891b3c8,,0,0,0,0,0,0,0,0,0,2,73,自然语言处理
DEMO: A Statistical Perspective for Efficient Image-Text Matching,2024,1,0,0,fc10ef4c76b4eeb82f48b3ea58875b40fbf6ec4e,,0,0,0,0,0,0,0,0,0,0,0,多模态学习
SeaEval for Multilingual Foundation Models: From Cross-Lingual Alignment to Cultural Reasoning,2024,95,44,1,05be16afbd1dec2f5dad0949686c3fbe9d44f466,,0,0,0,0,0,0,0,0,0,7,46,自然语言处理
Volcano: Mitigating Multimodal Hallucination through Self-Feedback Guided Revision,2024,80,32,0,de1894742b7f2e4fe02d9ff94761d6178e0a5d3c,,0,0,0,0,0,0,0,0,0,1,35,多模态学习
LLMs Are Few-Shot In-Context Low-Resource Language Learners,2024,82,24,0,4c01dfec69f5d55daae00b668665e94eb9da7f39,,0,0,0,0,0,0,0,0,0,0,20,自然语言处理
Rethinking Tabular Data Understanding with Large Language Models,2024,39,5,1,60f35bfe967dbce2c8694de8d283de01cc3766c2,,0,0,0,0,0,0,0,0,0,0,9,自然语言处理
From Shortcuts to Triggers: Backdoor Defense with Denoised PoE,2024,27,12,0,7264958c138579270ae79487985d5ac3b199f715,,0,0,0,0,0,0,0,0,0,3,17,模型可解释性、公平性、应用系统等
BookSQL: A Large Scale Text-to-SQL Dataset for Accounting Domain,2024,14,0,0,dc21a83c0b1c8002065b18ef2f90c7e53d9d1a17,,0,0,0,0,0,0,0,0,0,0,2,自然语言处理
FLAP: Flow-Adhering Planning with Constrained Decoding in LLMs,2024,14,4,0,3d6300263adb1a1e8000fd0eda55518a3642afa9,,0,0,0,0,0,0,0,0,0,0,5,自然语言处理
DuRE: Dual Contrastive Self Training for Semi-Supervised Relation Extraction,2024,0,0,0,df7bcd2a81f93ed29a65b3ecd8179b8ef3171803,,0,0,0,0,0,0,0,0,0,0,0,自然语言处理
Query-Efficient Textual Adversarial Example Generation for Black-Box Attacks,2024,3,0,0,eabc9976605d6fe7dfae895fd0f522a0ec5aa149,,0,0,0,0,0,0,0,0,0,0,0,自然语言处理
Embrace Divergence for Richer Insights: A Multi-document Summarization Benchmark and a Case Study on Summarizing Diverse Information from News Articles,2024,42,17,0,1221aa62d85770e1712c98fbe2fbaf8bad512861,,0,0,0,0,0,0,0,0,0,5,17,自然语言处理
AMRFact: Enhancing Summarization Factuality Evaluation with AMR-Driven Negative Samples Generation,2024,12,4,1,4e444759dc61f26dee627fbb909a15a5ad32b184,,0,0,0,0,0,0,0,0,0,1,4,自然语言处理
PILOT: Legal Case Outcome Prediction with Case Law,2024,17,3,0,50985d2fa9f31221b080e725dcf63278e9b62b73,,0,0,0,0,0,0,0,0,0,0,6,自然语言处理
ALoRA: Allocating Low-Rank Adaptation for Fine-tuning Large Language Models,2024,35,2,2,e4d913a4a1e5286b93e4dca0e032c58c3794e873,,0,0,0,0,0,0,0,0,0,0,9,机器学习（含深度学习）
R-Spin: Efficient Speaker and Noise-invariant Representation Learning with Acoustic Pieces,2024,6,5,0,599098b25424443ddf4df475659cc7624703f7ee,,0,0,0,0,0,0,0,0,0,0,3,表示学习与优化方法
InsCL: A Data-efficient Continual Learning Paradigm for Fine-tuning Large Language Models with Instructions,2024,51,14,0,76b65c248677314865a110424542c220886dbb67,,0,0,0,0,0,0,0,0,0,1,24,机器学习（含深度学习）
Language Agnostic Code Embeddings,2024,1,0,0,e0c2c9b11dc27932be2235b52e6da372105e5ed5,,0,0,0,0,0,0,0,0,0,0,0,自然语言处理
