title,year,citationCount,top_conf_citations,top_journal_citations,paperId,notes,citations_2014,citations_2015,citations_2016,citations_2017,citations_2018,citations_2019,citations_2020,citations_2021,citations_2022,citations_2023,citations_2024,ai_category
"Olive Oil is Made of Olives, Baby Oil is Made for Babies: Interpreting Noun Compounds Using Paraphrases in a Neural Model",2018,30,15,0,383f807f41d9f66572c6a8a6ae0b51c6bf4afae0,,0,0,0,0,2,7,6,6,3,2,1,自然语言处理
Similarity Measures for the Detection of Clinical Conditions with Verbal Fluency Tasks,2018,11,0,1,ebf19379d3a7b0af970f983e843b33d80ac6f5f7,,0,0,0,0,1,1,0,1,1,2,2,自然语言处理
Sluice Resolution without Hand-Crafted Features over Brittle Syntax Trees,2018,14,5,0,c77edeb876ecce945e87e102fa0f1a2095323878,,0,0,0,0,3,4,2,4,1,0,0,自然语言处理
The Word Analogy Testing Caveat,2018,35,8,0,a4bd874e52a265070d935fce9573f236ab565f2b,,0,0,0,0,0,4,7,7,6,4,5,自然语言处理
Transition-Based Chinese AMR Parsing,2018,12,3,0,65b7ca8e618f7116b13dc4abab8b410beb9ba701,,0,0,0,0,0,2,3,3,2,2,0,自然语言处理
Knowledge-Enriched Two-Layered Attention Network for Sentiment Analysis,2018,33,9,0,ce5860a66cf1df1849aafedb76a07e8c081a8c06,,0,0,0,0,0,9,9,6,6,2,0,自然语言处理
Letting Emotions Flow: Success Prediction by Modeling the Flow of Emotions in Books,2018,36,5,0,9d703b7dea1d2e79616e39b17bf19a7a6566f67e,,0,0,0,0,2,1,5,8,4,6,9,自然语言处理
Modeling Inter-Aspect Dependencies for Aspect-Based Sentiment Analysis,2018,72,17,0,0d310cf7f829b8704c591be6f55e98f78b288a34,,0,0,0,0,4,15,15,10,11,10,4,自然语言处理
Multi-Task Learning Framework for Mining Crowd Intelligence towards Clinical Treatment,2018,25,7,0,3b9a51e49335853bef9b9db7f2dca1062664138e,,0,0,0,0,3,2,9,3,1,5,1,机器学习（含深度学习）
Recurrent Entity Networks with Delayed Memory Update for Targeted Aspect-Based Sentiment Analysis,2018,53,12,2,c74ebd85e2056ade2cbbfa1d51a10fe1ac222a64,,0,0,0,0,3,10,18,8,6,5,1,自然语言处理
Near Human-Level Performance in Grammatical Error Correction with Hybrid Machine Translation,2018,99,36,1,ca54d56d8942b02ed6e7d441d37372a65c1cc920,,0,0,0,1,10,40,16,12,7,5,5,自然语言处理
Strong Baselines for Simple Question Answering over Knowledge Graphs with and without Neural Networks,2018,108,30,1,1154add9af6c19c8b264331308ec99776583c52d,,0,0,0,0,6,17,25,23,15,6,11,自然语言处理
Looking for Structure in Lexical and Acoustic-Prosodic Entrainment Behaviors,2018,26,11,0,e8700dcc03b5ee5dc58caa3d5eff56cfeeae0e12,,0,0,0,0,2,3,6,4,1,3,1,多模态学习
Modeling Semantic Plausibility by Injecting World Knowledge,2018,49,20,1,53e50a313ddfd222d958469edb6742f19458ec74,,0,0,0,0,3,5,11,6,4,7,7,自然语言处理
A Bi-Model Based RNN Semantic Frame Parsing Model for Intent Detection and Slot Filling,2018,205,75,5,74a74cd3a4f4e853ece428c3d6c5ea062dfcd246,,0,0,0,0,7,23,45,41,33,25,20,自然语言处理
A Comparison of Two Paraphrase Models for Taxonomy Augmentation,2018,6,1,1,d6687b754c082718cf6bafaa6889fafd9d24f8c0,,0,0,0,0,0,2,4,0,0,0,0,自然语言处理
A Laypeople Study on Terminology Identification across Domains and Task Definitions,2018,6,1,0,57fb9b7337268499c0c73692b3b6cca1ca92678a,,0,0,0,0,0,4,1,1,0,0,0,自然语言处理
A Novel Embedding Model for Knowledge Base Completion Based on Convolutional Neural Network,2018,785,181,19,41cbe3cdfee7539f8ff20144e6bd028ef762e00c,,0,0,0,1,12,57,107,107,147,140,117,表示学习与优化方法
Cross-language Article Linking Using Cross-Encyclopedia Entity Embedding,2018,0,0,0,6729b353f1c08d0c018df61a318a4a971ed25b27,,0,0,0,0,0,0,0,0,0,0,0,自然语言处理
Identifying the Most Dominant Event in a News Article by Mining Event Coreference Relations,2018,28,10,0,5fec6a0e4787eef338426bb5695f704fb372ab1e,,0,0,0,0,2,3,6,7,3,0,6,自然语言处理
Improve Neural Entity Recognition via Multi-Task Data Selection and Constrained Decoding,2018,9,1,0,8effcdd6e6d2ab9ae97978c535d385ccd2c36542,,0,0,0,0,1,1,3,1,1,0,2,自然语言处理
Keep Your Bearings: Lightly-Supervised Information Extraction with Ladder Networks That Avoids Semantic Drift,2018,7,3,0,1f5f29ac96bfde875137b9f9fc139082a3957ed9,,0,0,0,0,1,2,2,0,1,0,1,自然语言处理
Semi-Supervised Event Extraction with Paraphrase Clusters,2018,40,19,1,6b763095efe72aae6a2bbf409fdd4532f5f14243,,0,0,0,0,0,4,8,15,9,1,3,自然语言处理
Structure Regularized Neural Network for Entity Relation Classification for Chinese Literature Text,2018,12,1,0,a04cd171e5247c52c18c31a00f8510e61f0d798d,,0,0,0,0,1,0,2,2,3,0,3,自然语言处理
Syntactic Patterns Improve Information Extraction for Medical Search,2018,13,5,0,dcbc77336c9e9b99d98b3dc6ae2fdab148276965,,0,0,0,0,1,4,2,5,0,1,0,自然语言处理
Syntactically Aware Neural Architectures for Definition Extraction,2018,36,9,1,64568f5a2fea257da61b9931996538b9a0ce260c,,0,0,0,0,1,5,15,7,3,4,0,自然语言处理
A Dynamic Oracle for Linear-Time 2-Planar Dependency Parsing,2018,8,3,0,d2a5d797b514ea7bf2546d000346b5967fe12222,,0,0,0,0,2,1,2,3,0,0,0,自然语言处理
Are Automatic Methods for Cognate Detection Good Enough for Phylogenetic Reconstruction in Historical Linguistics?,2018,49,10,2,517d4697bd908b98986f363db111ad94dbe1cae3,,0,0,0,0,3,8,16,7,2,5,6,自然语言处理
Automatically Selecting the Best Dependency Annotation Design with Dynamic Oracles,2018,1,0,0,c7ebe9754da4f7eff56412683cba379b51360a19,,0,0,0,0,1,0,0,0,0,0,0,自然语言处理
Consistent CCG Parsing over Multiple Sentences for Improved Logical Reasoning,2018,3,1,0,4d21b9671fb7c0111cbb982a1ed1a728260fadab,,0,0,0,0,1,0,2,0,0,0,0,自然语言处理
Exploiting Dynamic Oracles to Train Projective Dependency Parsers on Non-Projective Trees,2018,4,2,0,030d70b31ce60b1009edb952186ce31cc7d4aeb6,,0,0,0,0,2,1,0,1,0,0,0,自然语言处理
Improving Coverage and Runtime Complexity for Exact Inference in Non-Projective Transition-Based Dependency Parsers,2018,1,1,0,e69f470c09c40d01f513c82d06ec1ce4cb0dcba4,,0,0,0,0,1,0,0,0,0,0,0,自然语言处理
Towards a Variability Measure for Multiword Expressions,2018,5,1,0,bcb49809bd52402c224c94edbf611da26ef700e2,,0,0,0,0,1,2,2,0,0,0,0,自然语言处理
Defoiling Foiled Image Captions,2018,10,3,0,8629c779581a0f46452bc4ca45b571bfbd3cd063,,0,0,0,0,0,1,0,2,1,2,2,自然语言处理
Pragmatically Informative Image Captioning with Character-Level Inference,2018,104,36,1,025f852b227766c3a5dc914ded6f6c0ae137c617,,0,0,0,0,3,22,15,16,14,11,11,自然语言处理
Object Ordering with Bidirectional Matchings for Visual Reasoning,2018,16,6,0,90800d28c61854659fd8d813158ecac5653695fa,,0,0,0,0,5,1,3,1,5,0,1,计算机视觉
Contextual Augmentation: Data Augmentation by Words with Paradigmatic Relations,2018,654,190,20,78a5efc6d0ef9a1e4cfd375e189474305d0b099f,,0,0,0,0,3,46,101,127,127,109,93,自然语言处理
Cross-Lingual Learning-to-Rank with Shared Representations,2018,48,21,0,2b6c68e0cb1a6a6e4092cc335cc0110d3583e035,,0,0,0,0,2,8,12,7,6,5,4,自然语言处理
Self-Attention with Relative Position Representations,2018,2570,730,85,c8efcc854d97dfc2a42b83316a2109f9d166e43f,,0,0,0,0,35,138,250,387,453,487,434,自然语言处理
Text Segmentation as a Supervised Learning Task,2018,169,42,6,102d54064e717bd0df985109fba6478f25405735,,0,0,0,0,1,14,23,23,23,35,21,自然语言处理
What’s in a Domain? Learning Domain-Robust Text Representations using Adversarial Training,2018,48,17,0,5f8c6e540710d0f54d0fbf8575d103c60c932409,,0,0,0,0,1,8,10,14,7,2,2,自然语言处理
Exploiting Semantics in Neural Machine Translation with Graph Convolutional Networks,2018,195,50,6,6411da05a0e6f3e38bcac0ce57c28038ff08081c,,0,0,0,1,6,28,42,40,35,21,13,自然语言处理
Incremental Decoding and Training Methods for Simultaneous Translation in Neural Machine Translation,2018,100,47,2,246805dc95ab2a51f3acfe1c3ae016994645aa3a,,0,0,0,0,0,7,22,26,14,15,11,自然语言处理
Learning Hidden Unit Contribution for Adapting Neural Machine Translation Models,2018,38,10,2,477c4f873379fd551182d05549f1c8e27d5c5bcf,,0,0,0,0,2,8,9,3,9,5,1,自然语言处理
Neural Machine Translation Decoding with Terminology Constraints,2018,113,48,1,16d572678b77c52365b56d748954cdc8735df492,,0,0,0,0,6,19,21,25,13,14,9,自然语言处理
On the Evaluation of Semantic Phenomena in Neural Machine Translation Using Natural Language Inference,2018,41,10,3,616898cab41f203674bc4364ff433b8bc0146b4d,,0,0,0,0,12,4,8,4,4,3,0,自然语言处理
Using Word Vectors to Improve Word Alignments for Low Resource Machine Translation,2018,19,2,0,8f4bf65a6b62cecc6f7b0ab2489a831d9a44a86d,,0,0,0,0,1,4,3,6,4,1,0,自然语言处理
When and Why Are Pre-Trained Word Embeddings Useful for Neural Machine Translation?,2018,365,116,10,7b29f45df975ed1e4c3864b6ab4483f11086aa76,,0,0,0,1,11,65,67,70,54,42,32,自然语言处理
Are All Languages Equally Hard to Language-Model?,2018,105,34,1,d323d011a3214116a18d623501bca9a31d33cf4c,,0,0,0,0,4,22,17,12,12,12,11,自然语言处理
The Computational Complexity of Distinctive Feature Minimization in Phonology,2018,0,0,0,87c001ab4f9f73bf93fdec70473bd4b73d02d412,,0,0,0,0,0,0,0,0,0,0,0,自然语言处理
Unsupervised Disambiguation of Syncretism in Inflected Lexicons,2018,5,2,0,29cad5d35f115036f32a61e81261d6662ff23da0,,0,0,0,0,1,1,1,1,0,0,0,自然语言处理
Contextualized Word Representations for Reading Comprehension,2018,42,14,0,80e697e6ed970c48b77caeb3cf6093f568c40100,,0,0,0,1,13,12,7,3,1,4,0,自然语言处理
Crowdsourcing Question-Answer Meaning Representations,2018,79,39,0,1a210410493fbc052f0b7a54e7bc89cee20e8d28,,0,0,0,0,6,17,17,15,11,8,4,自然语言处理
Leveraging Context Information for Natural Question Generation,2018,157,54,3,d3406f220c16a20b877f10f5609fa589b629cc91,,0,0,0,0,7,33,26,24,28,11,9,自然语言处理
Robust Machine Comprehension Models via Adversarial Training,2018,120,42,2,f8522bf98b92d1cb620a07eab318bf2a8fd1ea2a,,0,0,0,0,3,13,25,25,20,18,10,自然语言处理
Simple and Effective Semi-Supervised Question Answering,2018,67,27,1,7650d705b85dc399112a5b6a79e9c6f81c7c6146,,0,0,0,0,2,11,17,20,9,6,1,自然语言处理
TypeSQL: Knowledge-Based Type-Aware Neural Text-to-SQL Generation,2018,282,93,9,c81fcde61fb6038e8756c74e17294d4d1ba6d48d,,0,0,0,0,18,47,46,41,30,26,36,自然语言处理
Community Member Retrieval on Social Media Using Textual Information,2018,3,0,0,2b1c95b64ff108e783e0f1b4ad30fca5a1ba1fcf,,0,0,0,0,0,2,0,1,0,0,0,自然语言处理
Cross-Domain Review Helpfulness Prediction Based on Convolutional Neural Networks with Auxiliary Domain Discriminators,2018,51,18,2,455f62987d7314e85518291101ac0d34be483e95,,0,0,0,0,2,14,14,11,3,6,0,自然语言处理
Predicting Foreign Language Usage from English-Only Social Media Posts,2018,13,2,0,3d6b16290581952dcece2f41badf5638cc3b86da,,0,0,0,0,2,2,5,1,2,1,0,自然语言处理
A Discourse-Aware Attention Model for Abstractive Summarization of Long Documents,2018,837,292,21,853d4d94651c6d9f8ed4d114e1eb21f15f786daa,,0,0,0,0,8,35,90,129,149,161,134,自然语言处理
A Mixed Hierarchical Attention Based Encoder-Decoder Approach for Standard Table Summarization,2018,29,10,0,648de704d91fc7f2cc8acbccf4185d9a4d23ed87,,0,0,0,0,2,5,10,3,3,4,2,自然语言处理
Effective Crowdsourcing for a New Type of Summarization Task,2018,18,6,0,5318c0f1d7c2f16200dac5a3ebe0ef7246104528,,0,0,0,0,0,5,3,3,5,2,0,自然语言处理
Key2Vec: Automatic Ranked Keyphrase Extraction from Scientific Articles using Phrase Embeddings,2018,108,15,7,7c8de2abe8024de05d00095447d918b21960095d,,0,0,0,0,3,16,18,21,16,16,13,自然语言处理
Learning to Generate Wikipedia Summaries for Underserved Languages from Wikidata,2018,27,13,0,4363ff2dffef4b9735627c68b7687e33de1aec96,,0,0,0,0,2,9,3,2,4,2,1,自然语言处理
Multi-Reward Reinforced Summarization with Saliency and Entailment,2018,209,99,5,46d8767a078778aaa00d436b671a78f90667ebff,,0,0,0,0,15,38,38,40,30,26,15,强化学习与智能决策
Objective Function Learning to Match Human Judgements for Optimization-Based Summarization,2018,19,14,0,7ed8dd8a10ebf1508947c29c1e82f8a0197f9f78,,0,0,0,0,1,5,6,2,1,3,1,表示学习与优化方法
Pruning Basic Elements for Better Automatic Evaluation of Summaries,2018,0,0,0,7fa9d9f44da9982220613d927020956aebd9ceb4,,0,0,0,0,0,0,0,0,0,0,0,自然语言处理
Unsupervised Keyphrase Extraction with Multipartite Graphs,2018,214,35,13,05c728cb38f06dccd587beb9b0399157eebfbce8,,0,0,0,0,10,19,24,34,44,40,27,自然语言处理
Where Have I Heard This Story Before? Identifying Narrative Similarity in Movie Remakes,2018,23,6,1,4212523c23ff4e3a11ba22ab0f1163cb63b55a5a,,0,0,0,0,2,3,5,0,3,4,5,自然语言处理
Multimodal Emoji Prediction,2018,56,10,0,da036928ac807f15594eb8203656accb27855c17,,0,0,0,0,5,8,9,11,7,3,10,多模态学习
Higher-Order Coreference Resolution with Coarse-to-Fine Inference,2018,488,157,7,e6566ece21f6637c515fe9969f9d1ec6cca6d36c,,0,0,0,0,15,65,73,98,105,71,35,自然语言处理
Non-Projective Dependency Parsing with Non-Local Transitions,2018,17,6,0,1e2918073821de7fe05c5d066e5fc0a0f9733b6c,,0,0,0,1,6,4,4,2,0,0,0,自然语言处理
Detecting Linguistic Characteristics of Alzheimer’s Dementia by Interpreting Neural Models,2018,115,26,10,9620bda083e3a3b7d55a5fdc5198c5f62052d323,,0,0,0,0,3,12,29,20,17,19,7,自然语言处理
Deep Dungeons and Dragons: Learning Character-Action Interactions from Role-Playing Game Transcripts,2018,30,10,1,82657ba065e1111e09b363fa3fe8b053d865b1ef,,0,0,0,0,0,0,3,4,4,6,6,自然语言处理
Feudal Reinforcement Learning for Dialogue Management in Large Domains,2018,50,18,0,479ca4180fe7626dc16e97c0f06816cd3cd3bb09,,0,0,0,0,8,6,13,5,7,7,4,强化学习与智能决策
Evaluating Historical Text Normalization Systems: How Well Do They Generalize?,2018,24,11,0,ca008695bc1163d36270ca20c466930f7d86854b,,0,0,0,0,2,5,1,1,4,4,6,自然语言处理
Gated Multi-Task Network for Text Classification,2018,34,9,0,7c631ed990631106a3b27c8a46464ef6d12839db,,0,0,0,0,0,8,6,5,4,9,2,自然语言处理
Natural Language to Structured Query Generation via Meta-Learning,2018,126,57,1,9c0912153128e31743948cd629d6eebe6d916b42,,0,0,0,0,9,31,27,27,11,12,4,自然语言处理
Smaller Text Classifiers with Discriminative Cluster Embeddings,2018,6,3,0,01afba5f94c7b77a5edb30db9fd9c27e6718ac40,,0,0,0,0,1,3,2,0,0,0,0,自然语言处理
Role-specific Language Models for Processing Recorded Neuropsychological Exams,2018,9,3,0,7d08fd645aec05e5ef8e4d9defba55119bbd16f8,,0,0,0,0,0,1,1,0,3,0,1,自然语言处理
Slot-Gated Modeling for Joint Slot Filling and Intent Prediction,2018,492,199,13,903ec87f1eb8759520feecaf4a719608fa761e58,,0,0,0,0,8,55,93,99,87,79,46,自然语言处理
An Evaluation of Image-Based Verb Prediction Models against Human Eye-Tracking Data,2018,3,1,0,8f5110d544ca484bd8fd43cfe37db005e93c4648,,0,0,0,0,0,0,2,0,0,0,1,计算机视觉
Learning to Color from Language,2018,58,21,0,5ee96dd7e3395d8a53d6d3ceb62593477a4e0fe1,,0,0,0,0,1,5,5,9,10,11,9,多模态学习
Punny Captions: Witty Wordplay in Image Descriptions,2018,13,5,0,2d9830134f3ad0f66f75331ba73fe416bd76320f,,0,0,0,0,4,1,1,1,1,2,3,自然语言处理
The Emergence of Semantics in Neural Network Representations of Visual Information,2018,5,2,0,1a0796b37eb7f61a7543ccbaae422a5f5e9f7fc6,,0,0,0,0,1,1,1,0,0,2,0,计算机视觉
Visual Referring Expression Recognition: What Do Systems Actually Learn?,2018,65,31,0,8e2d8cee2fc474d0c08bfdfa707993d005067823,,0,0,0,0,2,12,17,9,8,9,6,计算机视觉
Visually Guided Spatial Relation Extraction from Text,2018,10,5,1,2d8d089d368f2982748fde93a959cf5944873673,,0,0,0,0,1,0,3,2,1,0,3,多模态学习
"Watch, Listen, and Describe: Globally and Locally Aligned Cross-Modal Attentions for Video Captioning",2018,79,25,1,2714a3932b9d096b7bb285f6ec415cb047eafe09,,0,0,0,1,6,10,20,17,10,7,4,多模态学习
"Proceedings of the 2019 Conference of the North American Chapter of the Association for Computational Linguistics: Human Language Technologies, Volume 1 (Long and Short Papers)",2019,51,22,0,d65b6b4b7e26aaa8fd44786921e56305f261c629,,0,0,0,0,0,0,6,9,11,9,12,自然语言处理
Entity Recognition at First Sight: Improving NER with Eye Movement Information,2019,58,19,1,54c2e45ca1cc280dfa48b6da8b5561b6513ca4a2,,0,0,0,0,0,4,10,7,7,12,11,自然语言处理
The emergence of number and syntax units in LSTM language models,2019,179,47,4,cca6f4177921be0dd0ea2794d9d788f265b44da0,,0,0,0,0,1,21,32,37,20,31,24,自然语言处理
Neural Self-Training through Spaced Repetition,2019,10,5,0,418e6749971b3e18efd7957d2d838e86e1986d06,,0,0,0,0,0,0,2,2,0,4,1,机器学习（含深度学习）
Neural language models as psycholinguistic subjects: Representations of syntactic state,2019,206,67,6,847a0a93ad97c8a31ef70d379517d8d72d4d9a46,,0,0,0,0,2,10,25,41,27,37,37,自然语言处理
Understanding language-elicited EEG data by predicting it from a fine-tuned language model,2019,22,4,3,dacd64e55bea910486289ceac2a5f94217433b79,,0,0,0,0,0,2,8,4,5,2,0,自然语言处理
Pre-training on high-resource speech recognition improves low-resource speech-to-text translation,2019,209,105,4,19f66dd83abef074b04169ed448251b55429e6d9,,0,0,0,0,2,31,35,44,33,27,18,自然语言处理
Measuring the perceptual availability of phonological features during language acquisition using unsupervised binary stochastic autoencoders,2019,23,10,0,514e1498a2ef6c4faa3a2fb5428cda760efe6f46,,0,0,0,0,0,1,9,3,2,4,1,自然语言处理
Giving Attention to the Unexpected: Using Prosody Innovations in Disfluency Detection,2019,32,12,1,926b3406a948898c8b32cabe6e137cf18c90cefa,,0,0,0,0,0,3,6,5,9,6,2,自然语言处理
Massively Multilingual Adversarial Speech Recognition,2019,79,53,1,3426fadf73a5ce418486e640b26b3d2470d932b5,,0,0,0,0,1,6,14,19,12,13,10,自然语言处理
Lost in Interpretation: Predicting Untranslated Terminology in Simultaneous Interpretation,2019,14,1,0,b990517fbbf4499861d7aa00407b0422874ab990,,0,0,0,0,0,1,4,3,2,1,1,自然语言处理
AudioCaps: Generating Captions for Audios in The Wild,2019,673,295,3,c4798919e74411d87f7745840e45b8bcf61128ff,,0,0,0,0,0,4,12,29,53,139,186,多模态学习
“President Vows to Cut \ensuremath<Taxes\ensuremath> Hair”: Dataset and Analysis of Creative Text Editing for Humorous Headlines,2019,97,13,0,74a56b27c19ac606612fc54d0d70ab50cd4a9e22,,0,0,0,0,0,0,39,17,11,8,13,自然语言处理
Answer-based Adversarial Training for Generating Clarification Questions,2019,118,43,1,9e2339e09e4537b0fcb7922f10851d970bd81c5e,,0,0,0,0,0,7,19,20,23,21,17,自然语言处理
Improving Grammatical Error Correction via Pre-Training a Copy-Augmented Architecture with Unlabeled Data,2019,224,89,2,f828b3c378434b8945c4e21472e7e2efa908b6eb,,0,0,0,0,0,35,46,40,29,31,24,自然语言处理
Topic-Guided Variational Auto-Encoder for Text Generation,2019,131,51,2,da487cccda0e5098ed8c3bfc5b7974914e628088,,0,0,0,0,1,19,33,24,19,18,12,自然语言处理
Implementation of a Chomsky-Schützenberger n-best parser for weighted multiple context-free grammars,2019,4,0,0,ff0f27abe0779928d4232f73eec6f865a3fbcfe8,,0,0,0,0,0,2,2,0,0,0,0,自然语言处理
Phylogenic Multi-Lingual Dependency Parsing,2019,10,3,0,4fbde3bd7d7cc1cfcbceb00d935138594662c465,,0,0,0,0,0,1,2,3,2,0,1,自然语言处理
Discontinuous Constituency Parsing with a Stack-Free Transition System and a Dynamic Oracle,2019,20,10,0,fe094e779e4f59c169e975285231abfd866b2acb,,0,0,0,0,0,2,9,4,0,3,1,自然语言处理
How Bad are PoS Tagger in Cross-Corpora Settings? Evaluating Annotation Divergence in the UD Project.,2019,5,1,0,12c5932f3428a483f8031fc0c13df4418af482de,,0,0,0,0,0,0,1,0,2,0,2,自然语言处理
CCG Parsing Algorithm with Incremental Tree Rotation,2019,20,7,0,1200a361942be306b501c541df9e9c1dd86cceb2,,0,0,0,0,0,1,4,8,3,1,2,自然语言处理
Cyclical Annealing Schedule: A Simple Approach to Mitigating KL Vanishing,2019,407,112,14,845cafab91da3441d56a8740f0c8038916863dcb,,0,0,0,0,1,19,54,68,67,77,56,表示学习与优化方法
Recurrent models and lower bounds for projective syntactic decoding,2019,0,0,0,540fae3e47b49b8c754fa0b56677193370e80052,,0,0,0,0,0,0,0,0,0,0,0,自然语言处理
Evaluating Composition Models for Verb Phrase Elliptical Sentence Embeddings,2019,23,3,1,71c29ec6f2782fd1f2e8935a1914583eae1d5a01,,0,0,0,0,0,1,8,7,2,2,3,自然语言处理
Neural Finite-State Transducers: Beyond Rational Relations,2019,15,9,0,740182c3aa9a3045fcd9370269d446455ae9f623,,0,0,0,0,0,1,4,5,1,3,1,自然语言处理
Riemannian Normalizing Flow on Variational Wasserstein Autoencoder for Text Modeling,2019,28,12,1,620d45497204ef9057232d49ad6ef39eaac5cba5,,0,0,0,0,0,6,11,3,2,4,1,表示学习与优化方法
A Study of Incorrect Paraphrases in Crowdsourced User Utterances,2019,21,6,0,0df932077d25679198db40de00b149eaca39d5c7,,0,0,0,0,0,0,6,4,2,3,6,自然语言处理
ComQA: A Community-sourced Dataset for Complex Factoid Question Answering with Paraphrase Clusters,2019,65,18,0,dcaca58d96c419dc330af4bca08a717ced79af20,,0,0,0,0,0,5,12,14,12,11,5,自然语言处理
FreebaseQA: A New Factoid QA Data Set Matching Trivia-Style Question-Answer Pairs with Freebase,2019,91,30,1,2dd939fe52a336451c83b4e048660f2a5a048265,,0,0,0,0,0,1,9,17,17,15,18,自然语言处理
Simple Question Answering with Subgraph Ranking and Joint-Scoring,2019,28,6,1,79416c1439ab642df7b379bbb7797f3586c4de72,,0,0,0,0,0,0,7,9,9,3,0,自然语言处理
Learning to Attend On Essential Terms: An Enhanced Retriever-Reader Model for Open-domain Question Answering,2019,38,12,0,94b0f87dddc59e0d1aa2c5d30748abfc0aaf19e0,,0,0,0,0,4,6,8,8,4,3,4,自然语言处理
UHop: An Unrestricted-Hop Relation Extraction Framework for Knowledge-Based Question Answering,2019,112,37,3,4e4230418470efbb3a86d407d8eedf329f361f6d,,0,0,0,0,0,1,6,25,23,22,17,自然语言处理
BAG: Bi-directional Attention Entity Graph Convolutional Network for Multi-hop Reasoning Question Answering,2019,79,20,3,4b390af2eb7f2fbfc7a7d9fe7b340d28bdb12926,,0,0,0,0,0,8,18,16,17,10,8,自然语言处理
Vector of Locally-Aggregated Word Embeddings (VLAWE): A Novel Document-level Representation,2019,34,6,1,603a448c7c17967e90d11bb6774f1e81e54e0789,,0,0,0,0,0,3,7,4,4,7,5,表示学习与优化方法
Multi-task Learning for Multi-modal Emotion Recognition and Sentiment Analysis,2019,193,37,6,093e72b8149826da54d224c21a8ac0e1d2f3ffa8,,0,0,0,0,0,3,25,28,29,41,36,多模态学习
Utilizing BERT for Aspect-Based Sentiment Analysis via Constructing Auxiliary Sentence,2019,680,122,32,0de47f354468283efc7765ec0b3588b2ae483c77,,0,0,0,0,0,29,108,127,128,120,77,自然语言处理
A Variational Approach to Weakly Supervised Document-Level Multi-Aspect Sentiment Classification,2019,21,8,0,f6be8b33bf77bc833c68ac12a7d95120faa71c51,,0,0,0,0,0,0,5,5,5,3,1,自然语言处理
HiGRU: Hierarchical Gated Recurrent Units for Utterance-Level Emotion Recognition,2019,150,46,3,35d92337c6dbe3f4b58f7bec82fc47a35aa5be2f,,0,0,0,0,0,5,18,22,16,28,31,自然语言处理
Learning Interpretable Negation Rules via Weak Supervision at Document Level: A Reinforcement Learning Approach,2019,20,6,1,c1eeb7f5291f550f2b190945bf90ecc57d173321,,0,0,0,0,0,3,3,6,3,2,1,强化学习与智能决策
Simplified Neural Unsupervised Domain Adaptation,2019,30,13,0,38b3d354766ea223ba3ff5c98175d3f4e4826e51,,0,0,0,0,0,1,9,10,4,1,4,机器学习（含深度学习）
Learning Bilingual Sentiment-Specific Word Embeddings without Cross-lingual Supervision,2019,18,2,1,0d0522810ea580e76ecba16e9ba59913aa829197,,0,0,1,0,0,2,5,3,3,1,2,自然语言处理
ReWE: Regressing Word Embeddings for Regularization of Neural Machine Translation Systems,2019,8,4,0,e38ec12f3f2749947dd73438162a18038b2bbd37,,0,0,0,0,0,2,3,2,0,1,0,自然语言处理
Lost in Machine Translation: A Method to Reduce Meaning Loss,2019,23,10,1,ed7c3eececad3915c865b7b11d88c338b0e0cbe1,,0,0,0,0,0,2,5,2,3,3,2,自然语言处理
Bi-Directional Differentiable Input Reconstruction for Low-Resource Neural Machine Translation,2019,17,4,1,e1aebc3a7aedd109079396488d6f48c2be3c7a70,,0,0,0,0,0,5,3,3,4,2,0,自然语言处理
Code-Switching for Enhancing NMT with Pre-Specified Translation,2019,125,49,3,d5067a342fc200e9613a61e64a0657dd9fc51896,,0,0,0,0,1,4,17,30,32,21,9,自然语言处理
Aligning Vector-spaces with Noisy Supervised Lexicon,2019,18,7,1,361904ad7588e9fbe133e1b5cf6f490bddcbd551,,0,0,0,0,0,3,7,4,3,1,0,表示学习与优化方法
Understanding and Improving Hidden Representations for Neural Machine Translation,2019,1,0,1,ccadcfda08021bed4671b061cc462b821d228b6b,,0,0,0,0,0,0,1,0,0,0,0,自然语言处理
Content Differences in Syntactic and Semantic Representation,2019,15,2,0,83aa50df8ccfbf5bb510cfbe8793485005e26cf1,,0,0,0,0,0,2,6,5,0,2,0,自然语言处理
Attentive Mimicking: Better Word Embeddings by Attending to Informative Contexts,2019,52,21,0,3cfd09d6d14fb9a34ee72a487cd610d168a60530,,0,0,0,0,0,7,9,13,6,5,8,表示学习与优化方法
Evaluating Style Transfer for Text,2019,122,41,0,37477f304279eef11f27e208dd8337adeedc5928,,0,0,0,0,1,11,16,22,21,18,18,自然语言处理
"Big BiRD: A Large, Fine-Grained, Bigram Relatedness Dataset for Examining Semantic Composition",2019,35,15,1,9817392064d6a340531d56b9e512fae993052bf0,,0,0,0,0,0,0,4,8,6,3,13,自然语言处理
Outlier Detection for Improved Data Quality and Diversity in Dialog Systems,2019,50,21,1,b000e8852951a97ec003626017307204666b1499,,0,0,0,0,0,0,6,8,10,11,9,自然语言处理
Asking the Right Question: Inferring Advice-Seeking Intentions from Personal Narratives,2019,11,5,0,7661f5e525d21b014de5bca5ee0e54d7fc967b32,,0,0,0,0,0,0,5,2,0,2,2,自然语言处理
Seeing Things from a Different Angle:Discovering Diverse Perspectives about Claims,2019,136,58,2,3e9cfcf73c6b8000d6724650fdc48d5f1a5802b1,,0,0,0,0,0,12,18,21,20,20,25,自然语言处理
IMHO Fine-Tuning Improves Claim Detection,2019,64,24,0,1565dbd85a32d62c50347ff1c27f3f7aaa8e5ab1,,0,0,0,0,0,1,5,18,13,17,7,自然语言处理
