title,year,citationCount,top_conf_citations,top_journal_citations,paperId,notes,citations_2014,citations_2015,citations_2016,citations_2017,citations_2018,citations_2019,citations_2020,citations_2021,citations_2022,citations_2023,citations_2024,ai_category
LightningDOT: Pre-training Visual-Semantic Embeddings for Real-Time Image-Text Retrieval,2021,89,22,1,7a1e7151ac3e76c52cbcd287299742eb2076d34c,,0,0,0,0,0,0,0,14,31,23,12,多模态学习
Measuring Social Biases in Grounded Vision and Language Embeddings,2021,69,30,0,0af07469cd031061ac6c5783d5bd0399ac48812e,,0,0,0,0,0,0,1,5,16,20,14,模型可解释性、公平性、应用系统等
MTAG: Modal-Temporal Attention Graph for Unaligned Human Multimodal Language Sequences,2021,110,30,3,26c3885abe14d14e2aa98a7ead2ebccca56a6283,,0,0,0,0,0,0,0,5,16,29,30,多模态学习
Grounding Open-Domain Instructions to Automate Web Support Tasks,2021,51,22,0,1905db8aef0d63d594b38a53939206fbef9fcd65,,0,0,0,0,0,0,1,2,5,7,22,自然语言处理
Modular Networks for Compositional Instruction Following,2021,28,14,0,35c6bdab35e8fd4e982302b5270da3c8098c58b1,,0,0,0,0,0,1,1,2,6,14,5,自然语言处理
Improving Cross-Modal Alignment in Vision Language Navigation via Syntactic Information,2021,35,17,1,2df14c28dc4ebd6ce3411884f0824eaa42aaf7c8,,0,0,0,0,0,0,0,4,9,8,9,多模态学习
Improving Pretrained Models for Zero-shot Multi-label Text Classification through Reinforced Label Hierarchy Reasoning,2021,25,7,0,ea587cdf0d6821742b80ef599f4b31cf097af84e,,0,0,0,0,0,0,0,3,5,10,3,自然语言处理
Fine-Tuning Pre-trained Language Model with Weak Supervision: A Contrastive-Regularized Self-Training Approach,2021,141,58,6,55efb2017096ad264e8df29b8b1710b8490c297a,,0,0,0,0,0,0,1,14,41,42,24,自然语言处理
Posterior Differential Regularization with f-divergence for Improving Model Robustness,2021,32,18,0,1a2bed6bed5f28095ebe5793f0c31d38690d6cd4,,0,0,0,0,0,0,1,14,7,8,2,表示学习与优化方法
Understanding Hard Negatives in Noise Contrastive Estimation,2021,61,23,0,274b9cce94bc5ab6d30a62ecaeb424cce829af60,,0,0,0,0,0,0,1,7,14,19,9,表示学习与优化方法
Certified Robustness to Word Substitution Attack with Differential Privacy,2021,50,18,0,0021b3beb2ee0906b425eef7c0f453623c1c6a03,,0,0,0,0,0,0,0,2,12,16,13,自然语言处理
DReCa: A General Task Augmentation Strategy for Few-Shot Natural Language Inference,2021,29,14,2,186c304c782c70b0b5d571ea140a8fb4ebcf31a4,,0,0,0,0,0,0,0,6,12,5,4,自然语言处理
Harnessing Multilinguality in Unsupervised Machine Translation for Rare Languages,2021,33,10,2,21db684d6b7bfd13538e78cb2fecab1b5e91e0e7,,0,0,0,0,0,0,0,13,8,8,3,自然语言处理
Macro-Average: Rare Types Are Important Too,2021,27,7,1,3b34e79610e5acaba352def4323a59f6d531fac7,,0,0,0,0,0,0,1,0,3,11,8,概率统计与推理基础
Assessing Reference-Free Peer Evaluation for Machine Translation,2021,11,8,0,08c828c70be6fe604c272afe308ff4ac2bc734c7,,0,0,0,0,0,0,0,1,4,1,2,自然语言处理
The Curious Case of Hallucinations in Neural Machine Translation,2021,218,75,3,143cd4b4717651caf276c7256502dc491454e197,,0,0,0,0,0,0,0,11,36,77,54,自然语言处理
Towards Continual Learning for Multilingual Machine Translation via Vocabulary Substitution,2021,50,26,0,2b66a0d8a00b0ba7b585e11ab34879420ad351cb,,0,0,0,0,0,0,0,5,17,11,8,自然语言处理
Towards Modeling the Style of Translators in Neural Machine Translation,2021,16,5,0,9aa2459d69ec3f2804413e45e2a0f489f5ea9c8b,,0,0,0,0,0,0,0,3,5,3,4,自然语言处理
Self-Supervised Test-Time Learning for Reading Comprehension,2021,31,15,0,f14c6acf6d04b3bd69c6d1a59ea8659bf3b95561,,0,0,0,0,0,0,1,4,6,10,5,自然语言处理
Capturing Row and Column Semantics in Transformer Based Question Answering over Tables,2021,59,36,1,1066d94640d1374cc1f21b49083095e1cbcdc67f,,0,0,0,0,0,0,0,7,17,20,9,自然语言处理
Explainable Multi-hop Verbal Reasoning Through Internal Monologue,2021,25,10,1,82deb8df3f3c765a4a84dc072cf2a20ecaefa420,,0,0,0,0,0,0,0,1,5,11,4,模型可解释性、公平性、应用系统等
Robust Question Answering Through Sub-part Alignment,2021,14,5,0,6606f7b9938dcc0e03dba45359dd04cb15018f13,,0,0,0,0,0,0,0,2,6,2,3,自然语言处理
Text Modular Networks: Learning to Decompose Tasks in the Language of Existing Models,2021,91,43,1,0e1d82d24d58433ce9e211551605a0bfd296624f,,0,0,0,0,0,0,1,17,24,31,8,自然语言处理
RECONSIDER: Improved Re-Ranking using Span-Focused Cross-Attention for Open Domain Question Answering,2021,22,11,0,c435fdeff9d3b30c3bece24429123d23da147992,,0,0,0,0,0,0,2,5,7,4,1,自然语言处理
On the Transferability of Minimal Prediction Preserving Inputs in Question Answering,2021,2,1,0,2facbd54b2f8527018453a89e0bb0eb69ae53df1,,0,0,0,0,0,0,0,0,2,0,0,自然语言处理
Understanding by Understanding Not: Modeling Negation in Language Models,2021,98,34,1,408cc1103ab953a26c7071ffd9ce808469f77a01,,0,0,0,0,0,0,0,4,27,29,20,自然语言处理
DuoRAT: Towards Simpler Text-to-SQL Models,2021,28,15,1,a2462ff5546b45b1cc7cb50ffc50c7ddececca65,,0,0,0,0,0,0,1,5,9,9,3,自然语言处理
Looking Beyond Sentence-Level Natural Language Inference for Question Answering and Text Summarization,2021,59,22,0,9541fd32d09728ce10b105cbcd662a081cefab68,,0,0,0,0,0,0,0,4,11,18,18,自然语言处理
Structure-Grounded Pretraining for Text-to-SQL,2021,186,79,3,3ff5f99c7924b4b28669f09ce3bfbf26fd92abc1,,0,0,0,0,0,0,3,25,35,28,42,自然语言处理
"Incremental Few-shot Text Classification with Multi-round New Classes: Formulation, Dataset and System",2021,55,24,0,65cc7839ee6e595382bb45b15968c565746d1d94,,0,0,0,0,0,0,0,5,14,16,13,自然语言处理
Temporal Reasoning on Implicit Events from Distant Supervision,2021,86,45,0,b52816323bde9a04c07ddfd4920fa28c6b0dee37,,0,0,0,0,0,0,1,9,23,19,16,自然语言处理
Disentangling Semantics and Syntax in Sentence Embeddings with Pre-trained Language Models,2021,27,10,1,9a93e530ed611f14f917d2612788f1ba2a050cbb,,0,0,0,0,0,0,0,3,4,9,4,自然语言处理
Structure-Aware Abstractive Conversation Summarization via Discourse and Action Graphs,2021,106,48,2,be9679047ff70d6147dbdb42521f62c5660f6f75,,0,0,0,0,0,0,0,12,27,32,20,自然语言处理
A New Approach to Overgenerating and Scoring Abstractive Summaries,2021,18,13,1,4779a89320f27b309984f40fe0a3e97c71ce6afa,,0,0,0,0,0,0,0,5,8,3,1,自然语言处理
D2S: Document-to-Slide Generation Via Query-Based Text Summarization,2021,44,15,0,77c5ebea69b0c11653d79c2c721e456d6bcc8b3a,,0,0,0,0,0,0,0,2,7,9,10,自然语言处理
Efficient Attentions for Long Document Summarization,2021,347,130,4,9dc624d7258d1a56117ca720aea953ce46b66b21,,0,0,0,0,0,0,0,19,46,72,100,自然语言处理
RefSum: Refactoring Neural Summarization,2021,41,21,0,15251fa3a3bcf695bf153d0856886cab9a3145ea,,0,0,0,0,0,0,0,6,17,10,6,自然语言处理
Annotating and Modeling Fine-grained Factuality in Summarization,2021,166,92,2,f434ca09c7e4acd8dbe2ba54c1a99a930bbfeeba,,0,0,0,0,0,0,0,12,45,54,37,自然语言处理
Larger-Context Tagging: When and Why Does It Work?,2021,5,1,0,5c090d8b0cb5e9f54f3da2323b830812f5721644,,0,0,0,0,0,0,0,1,2,1,1,自然语言处理
Neural Sequence Segmentation as Determining the Leftmost Segments,2021,5,3,0,a7a8d08c2285c293c9a7650fc36dbd8888fef508,,0,0,0,0,0,0,0,2,2,1,0,自然语言处理
PCFGs Can Do Better: Inducing Probabilistic Context-Free Grammars with Many Symbols,2021,27,17,1,ce38ecff6584e6bb6a5cc3ecaf0c152014eea4ff,,0,0,0,0,0,0,0,3,6,6,6,自然语言处理
GEMNET: Effective Gated Gazetteer Representations for Recognizing Complex Entities in Low-context Input,2021,75,8,0,6cf4c68c5d91824dd4bb8813324e5a289934aaa1,,0,0,0,0,0,0,0,3,39,27,5,自然语言处理
Video-aided Unsupervised Grammar Induction,2021,28,16,0,ac3d2fd5c32deca0512c0dfee921a5fa91499bcf,,0,0,0,0,0,0,0,3,12,4,5,多模态学习
Generating Negative Samples by Manipulating Golden Responses for Unsupervised Learning of a Response Evaluation Model,2021,13,7,0,a7a00e14c60fd13bf08dc435e9b0fdd96d050b99,,0,0,0,0,0,0,0,2,0,5,2,自然语言处理
How Robust are Fact Checking Systems on Colloquial Claims?,2021,16,7,0,828ace8bc78f6ab0636d5c7183e773a0e49d367c,,0,0,0,0,0,0,0,2,3,6,4,自然语言处理
Fine-grained Post-training for Improving Retrieval-based Dialogue Systems,2021,72,29,1,9f359007e9af7e49e95b3bba3c8621c6fa2f8cca,,0,0,0,0,0,0,0,6,22,25,10,自然语言处理
Put Chatbot into Its Interlocutor’s Shoes: New Framework to Learn Chatbot Responding with Intention,2021,5,3,0,3336a84e248cc858b02cb63598c48a26be60b869,,0,0,0,0,0,0,0,0,2,1,2,自然语言处理
Adding Chit-Chat to Enhance Task-Oriented Dialogues,2021,74,30,2,3c64247b4c75c64b4a67d306200bab5b5d3b5bfa,,0,0,0,0,1,0,0,5,22,23,10,自然语言处理
Incorporating Syntax and Semantics in Coreference Resolution with Heterogeneous Graph Attention Network,2021,14,6,0,deb29fedbd57d6851e56751b8f1ce7dd7644b025,,0,0,0,0,0,0,0,0,3,8,1,自然语言处理
Context Tracking Network: Graph-based Context Modeling for Implicit Discourse Relation Recognition,2021,24,6,2,657134c793f171c6cd379b5bf5495a8b21cb6a18,,0,0,0,0,0,0,0,5,5,3,7,自然语言处理
Improving Neural RST Parsing Model with Silver Agreement Subtrees,2021,13,7,0,47597b92175ac42e20ac0faf365bccac405559cb,,0,0,0,0,0,0,0,2,4,4,1,自然语言处理
RST Parsing from Scratch,2021,25,14,0,56d4ffb7c010a304984c00e1d8b9a911896ac157,,0,0,0,0,0,0,0,5,5,7,5,自然语言处理
Did they answer? Subjective acts and intents in conversational discourse,2021,22,9,0,f09558dc121c0ad17e562fbc31c7d966e50141c6,,0,0,0,0,0,0,0,3,5,4,7,自然语言处理
Evaluating the Impact of a Hierarchical Discourse Representation on Entity Coreference Resolution Performance,2021,3,2,0,93a5eae16445853aec49b0645c100fd8dae1b1e3,,0,0,0,0,0,0,0,0,1,1,1,自然语言处理
Bridging Resolution: Making Sense of the State of the Art,2021,14,2,0,74ab3c277638266bbadbfc5066cf6f5065287d0c,,0,0,0,0,0,0,0,3,6,3,2,自然语言处理
Explicitly Modeling Syntax in Language Models with Incremental Parsing and a Dynamic Oracle,2021,5,5,0,7e04ee74a5d8e1e7b0892b25e1f32f64b15fa640,,0,0,0,0,0,0,0,1,2,1,1,自然语言处理
Revisiting the Weaknesses of Reinforcement Learning for Neural Machine Translation,2021,48,22,0,a109b995dfeb444417f66545c67bce210bd11650,,0,0,0,0,0,0,0,4,15,19,6,强化学习与智能决策
Learning to Organize a Bag of Words into Sentences with Neural Networks: An Empirical Study,2021,9,2,0,fa3ec5da7e08fb9257da3c9449659bcf260e869f,,0,0,0,0,0,0,0,2,2,4,0,自然语言处理
Mask Attention Networks: Rethinking and Strengthen Transformer,2021,76,21,7,712bf9c7202b8dec3d06491a380bbac9c9600fbc,,0,0,0,0,0,0,0,10,21,17,19,自然语言处理
ERNIE-Gram: Pre-Training with Explicitly N-Gram Masked Language Modeling for Natural Language Understanding,2021,41,7,0,e50aabe91493365034f8c997bb1d1db689526a89,,0,0,0,0,0,0,0,11,9,11,6,自然语言处理
Lattice-BERT: Leveraging Multi-Granularity Representations in Chinese Pre-trained Language Models,2021,39,14,0,111dbe14083359ab39886790632e7f1421732a8a,,0,0,0,0,0,0,0,4,12,13,5,自然语言处理
Modeling Event Plausibility with Consistent Conceptual Abstraction,2021,20,8,0,826ff1912a768386662a446176aad7ed424b9086,,0,0,0,0,0,0,0,2,5,4,7,自然语言处理
UmlsBERT: Clinical Domain Knowledge Augmentation of Contextual Embeddings Using the Unified Medical Language System Metathesaurus,2021,135,20,8,03935e520c612ac9f137d9e9ef388e0c08568b60,,0,0,0,0,0,0,1,19,34,40,23,自然语言处理
Field Embedding: A Unified Grain-Based Framework for Word Representation,2021,1,1,0,50e5eacd61cbda15924ce26365efe327462aa4f5,,0,0,0,0,0,0,0,0,1,0,0,自然语言处理
MelBERT: Metaphor Detection via Contextualized Late Interaction using Metaphorical Identification Theories,2021,114,36,2,ff264e7831aca07b69bc02fd667d03bac1751b39,,0,0,0,0,0,0,0,6,19,28,45,自然语言处理
Non-Parametric Few-Shot Learning for Word Sense Disambiguation,2021,15,3,2,591a63c6f56b06aa7498592f6083c032fa77e2da,,0,0,0,0,0,0,0,2,4,5,2,自然语言处理
Why Do Document-Level Polarity Classifiers Fail?,2021,8,0,0,aea74e30391abe22c43042f212c7891fcc7cf456,,0,0,0,0,0,0,0,0,1,3,2,自然语言处理
A Unified Span-Based Approach for Opinion Mining with Syntactic Constituents,2021,26,11,0,5c1ead68c2053669a4d38dc39728a93ec34338df,,0,0,0,0,0,0,1,3,3,9,4,自然语言处理
Target-specified Sequence Labeling with Multi-head Self-attention for Target-oriented Opinion Words Extraction,2021,13,5,0,da92fa7e9e9dc9460391cd623f571e0d446910c0,,0,0,0,0,0,0,0,0,8,2,1,自然语言处理
Does syntax matter? A strong baseline for Aspect-based Sentiment Analysis with RoBERTa,2021,181,42,5,0b7b605a2d6e0cb1e53d1fa03311278e95f99260,,0,0,0,0,0,0,0,17,57,49,30,自然语言处理
Domain Divergences: A Survey and Empirical Analysis,2021,42,12,0,95cb2118e74e68727d2b9429606ff95afe09a7bd,,0,0,0,0,0,0,0,7,10,10,10,基础 AI 理论
Target-Aware Data Augmentation for Stance Detection,2021,45,22,2,8cfc53e9b4e197a6289e36470543846b64cc038c,,0,0,0,0,0,0,0,5,11,13,9,自然语言处理
End-to-end ASR to jointly predict transcriptions and linguistic annotations,2021,14,10,0,ec04862dedaa8f234b66852a7cae02f6da29ea80,,0,0,0,0,0,0,0,0,4,3,4,自然语言处理
Source and Target Bidirectional Knowledge Distillation for End-to-end Speech Translation,2021,45,28,0,89a8edbc0fe2ea8b9ee703ca37e5d5d6d34c571a,,0,0,0,0,0,0,0,8,10,16,6,自然语言处理
Searchable Hidden Intermediates for End-to-End Models of Decomposable Sequence Tasks,2021,35,24,0,ca3535dcdda9849350ad7c991a60660b22844f2f,,0,0,0,0,0,0,0,6,10,11,2,自然语言处理
SPLAT: Speech-Language Joint Pre-Training for Spoken Language Understanding,2021,71,52,0,8eda64d93e4d1ce5aef1405f99d15004db9028c5,,0,0,0,0,0,0,0,8,31,19,8,自然语言处理
Worldly Wise (WoW) - Cross-Lingual Knowledge Fusion for Fact-based Visual Spoken-Question Answering,2021,9,4,0,1826691df2f1ff87a12f944f6ef5583c9a6ceef4,,0,0,0,0,0,0,0,0,1,4,2,多模态学习
Align-Refine: Non-Autoregressive Speech Recognition via Iterative Realignment,2021,57,41,1,533a8eaa4a224d0392011575c47f0e8ba68e3fed,,0,0,0,0,0,0,0,15,16,11,9,自然语言处理
Everything Has a Cause: Leveraging Causal Inference in Legal Text Analysis,2021,38,11,1,1a80bd78b5a5238b880794cb2fb0d261c042741f,,0,0,0,0,0,0,0,2,8,11,8,自然语言处理
Counterfactual Supporting Facts Extraction for Explainable Medical Record Based Diagnosis with Graph Network,2021,30,3,2,77b43ef117701b2f211c8255899bc2180478db2d,,0,0,0,0,0,0,0,1,10,8,6,模型可解释性、公平性、应用系统等
Personalized Response Generation via Generative Split Memory Network,2021,67,20,0,a27ef1cae80d9a72734868b7a5d4e5092452dc31,,0,0,0,0,0,0,0,4,11,19,20,自然语言处理
Towards Few-shot Fact-Checking via Perplexity,2021,96,32,4,b798969c3e78215a87e8f3da510232b40893bd9c,,0,0,0,0,0,0,0,9,21,25,25,自然语言处理
Active² Learning: Actively reducing redundancies in Active Learning methods for Sequence Tagging and Machine Translation,2021,5,3,0,957f4253a2e836cb4f2b075ed98584aed7039ebf,,0,0,0,0,0,0,0,0,3,1,1,机器学习（含深度学习）
Generating An Optimal Interview Question Plan Using A Knowledge Graph And Integer Linear Programming,2021,7,2,1,b28bb8308d8470d3a5fc00716cb9263dbee1893e,,0,0,0,0,0,0,0,0,2,3,0,基础 AI 理论
"Model Extraction and Adversarial Transferability, Your BERT is Vulnerable!",2021,111,31,2,16a8e329c06b4c6f61762da7fa77a84bf3e12dca,,0,0,0,0,0,0,1,8,21,35,26,自然语言处理
A Global Past-Future Early Exit Method for Accelerating Inference of Pre-trained Language Models,2021,44,22,0,03662672662f49e6b06148e94b407b60b0bb72f3,,0,0,0,0,0,0,2,2,12,10,13,自然语言处理
Masked Conditional Random Fields for Sequence Labeling,2021,19,4,2,8e9a88d991caf44b8af26234454db5d10ad434b9,,0,0,0,0,0,0,0,2,3,5,6,自然语言处理
Heterogeneous Graph Neural Networks for Concept Prerequisite Relation Learning in Educational Data,2021,17,2,0,9f496f6c951819bb2a0931db8088b9c6d18a4f46,,0,0,0,0,0,0,0,2,3,6,2,表示学习与优化方法
Be Careful about Poisoned Word Embeddings: Exploring the Vulnerability of the Embedding Layers in NLP Models,2021,167,70,1,5e31fa4e69d1a3587230f5d134c0b7e2ed84a742,,0,0,0,0,0,0,1,14,26,46,51,自然语言处理
DA-Transformer: Distance-aware Transformer,2021,44,15,0,d8342a02f1c03023b8298b2047cb34d4f771cc30,,0,0,0,0,0,0,0,8,7,13,7,自然语言处理
ASAP: A Chinese Review Dataset Towards Aspect Category Sentiment Analysis and Rating Prediction,2021,75,22,4,01d8767bc1bab0990b161f5a7ce093fe6c2e523d,,0,0,0,0,0,0,0,1,16,19,23,自然语言处理
Are NLP Models really able to Solve Simple Math Word Problems?,2021,1036,352,11,13c4e5a6122f3fa2663f63e49537091da6532f35,,0,0,0,0,0,0,0,13,61,246,369,自然语言处理
WRIME: A New Dataset for Emotional Intensity Estimation with Subjective and Objective Annotations,2021,46,8,0,70d73c5c519a7259a52da232a8392616ec283c52,,0,0,0,0,0,0,0,1,9,7,13,自然语言处理
KPQA: A Metric for Generative Question Answering Using Keyphrase Weights,2021,18,4,1,5f5e7284f9179f0a86ce4f1c9c9f93957e6b387b,,0,0,0,0,0,0,0,1,2,5,4,自然语言处理
StylePTB: A Compositional Benchmark for Fine-grained Controllable Text Style Transfer,2021,45,20,0,483927605b43cb9e33f785a11223581c5f8615b8,,0,0,0,0,0,0,0,6,12,16,6,自然语言处理
Blow the Dog Whistle: A Chinese Dataset for Cant Understanding with Common Sense and World Knowledge,2021,16,5,0,1e5b05838e16244310db554b04ff6541f05acb0b,,0,0,0,0,0,0,0,2,4,5,5,自然语言处理
COVID-19 Named Entity Recognition for Vietnamese,2021,41,13,1,64017adc3782877d69ba7144a3a9a490dec8209c,,0,0,0,0,0,0,0,4,13,10,9,自然语言处理
Framing Unpacked: A Semi-Supervised Interpretable Multi-View Model of Media Frames,2021,13,6,0,e719246b01009d3a91f9b0d76e2987c1ea534571,,0,0,0,0,0,0,0,1,1,5,3,模型可解释性、公平性、应用系统等
Automatic Classification of Neutralization Techniques in the Narrative of Climate Change Scepticism,2021,11,2,0,a9d09338a3a0d9102c1e623e6ad434a446c0bbfe,,0,0,0,0,0,0,0,2,1,2,3,自然语言处理
Suicide Ideation Detection via Social and Temporal User Representations using Hyperbolic Learning,2021,47,15,0,ce5c64061eb6945478761d85cfca130e7716d36c,,0,0,0,0,0,0,0,2,15,8,16,自然语言处理
WikiTalkEdit: A Dataset for modeling Editors’ behaviors on Wikipedia,2021,7,2,0,8497617d225cb125b74b4c1ca308aee559883775,,0,0,0,0,0,0,0,0,1,3,1,自然语言处理
The structure of online social networks modulates the rate of lexical change,2021,10,3,0,1fdbb5ba5581d10a163b4ace20a8dfe0273677b6,,0,0,0,0,0,0,0,0,1,2,4,自然语言处理
Modeling Framing in Immigration Discourse on Social Media,2021,86,35,2,0b9adbb82d940340bf68b7505c47508379c741fb,,0,0,0,0,0,0,0,4,18,15,24,自然语言处理
Modeling the Severity of Complaints in Social Media,2021,23,5,1,bfc77a30c12c4d92efbd7be41696363ad2556316,,0,0,0,0,0,0,0,2,4,6,7,自然语言处理
What About the Precedent: An Information-Theoretic Analysis of Common Law,2021,14,4,0,063bfb1cb74a8150a5378125cd34d998aac9dd21,,0,0,0,0,0,0,0,2,4,4,2,概率统计与推理基础
Introducing CAD: the Contextual Abuse Dataset,2021,123,39,4,0819e62e97f7c4ac88d4659b9e3bff2cae436ed1,,0,0,0,0,0,0,1,8,24,31,32,自然语言处理
Lifelong Learning of Hate Speech Classification on Social Media,2021,26,8,1,1c8a6345508583043c2d03a2dc7e9999c34b1a77,,0,0,0,0,0,0,0,2,10,6,5,自然语言处理
Learning to Recognize Dialect Features,2021,41,25,0,64414f14be365625c51c060263ba8fbfd623920b,,0,0,0,0,0,0,0,5,10,11,11,自然语言处理
It’s Not Just Size That Matters: Small Language Models Are Also Few-Shot Learners,2021,1046,395,21,f30444fbb6ad806168e2564db4815cd27faa7fd9,,0,0,0,0,0,0,11,155,285,265,192,自然语言处理
Static Embeddings as Efficient Knowledge Bases?,2021,20,10,0,92287e1b979e9a2cf0548bd503a0504ad2f6d54d,,0,0,0,0,0,0,0,6,7,3,2,表示学习与优化方法
Highly Efficient Knowledge Graph Embedding Learning with Orthogonal Procrustes Analysis,2021,16,6,0,d7ef14459674b75807cd9be549f1e12d53849ead,,0,0,0,0,0,0,0,3,6,4,1,表示学习与优化方法
Rethinking Network Pruning – under the Pre-train and Fine-tune Paradigm,2021,65,24,4,40235eded15f44c8c4a7f48468adcc7df4e171fb,,0,0,0,0,0,0,0,8,12,17,16,机器学习（含深度学习）
Towards a Comprehensive Understanding and Accurate Evaluation of Societal Biases in Pre-Trained Transformers,2021,64,19,1,2cc0e605470d3ac20aad82c73560b888ecc449cd,,0,0,0,0,0,0,1,4,16,21,16,模型可解释性、公平性、应用系统等
Detoxifying Language Models Risks Marginalizing Minority Voices,2021,135,53,2,4ae632b89089b38ce41d307a6cda4727e42aaab3,,0,0,0,0,0,0,0,8,31,44,32,自然语言处理
HONEST: Measuring Hurtful Sentence Completion in Language Models,2021,175,49,3,4f76d26369ee573cb03db4b9f6e4ab5d61806095,,0,0,0,0,0,0,0,12,29,40,52,自然语言处理
EaSe: A Diagnostic Tool for VQA based on Answer Diversity,2021,3,3,0,d22c52cb6e83f9a9239071dba95e7ec73b9cd670,,0,0,0,0,0,0,0,0,1,2,0,计算机视觉
DeCEMBERT: Learning from Noisy Instructional Videos via Dense Captions and Entropy Minimization,2021,54,29,0,d56a1311b2d73513415b028f148c11735aea8004,,0,0,0,0,0,0,0,9,15,18,9,多模态学习
Improving Generation and Evaluation of Visual Stories via Semantic Consistency,2021,64,22,1,87a0279c1d640b486dc5c9f1e0d3705ed87754cf,,0,0,0,0,0,0,0,2,10,18,25,计算机视觉
Multilingual Multimodal Pre-training for Zero-Shot Cross-Lingual Transfer of Vision-Language Models,2021,60,27,0,25efc17ba82ba4af29f2e03868de74e1ea66d025,,0,0,0,0,0,0,1,9,20,19,9,多模态学习
Video Question Answering with Phrases via Semantic Roles,2021,16,12,0,1161e9556092cf9bf2923e0b15d03b01be1ce929,,0,0,0,0,0,0,0,2,5,7,1,计算机视觉
From Masked Language Modeling to Translation: Non-English Auxiliary Tasks Improve Zero-shot Spoken Language Understanding,2021,58,19,0,14c940926a046e6c33cc4eca9ea73cac1bcfa347,,0,0,0,0,0,0,0,5,13,14,15,自然语言处理
WEC: Deriving a Large-scale Cross-document Event Coreference dataset from Wikipedia,2021,33,13,1,a814f3773b6482b7f5c8ba8c3edfedb726999574,,0,0,0,0,0,0,0,8,5,6,10,自然语言处理
Challenging distributional models with a conceptual network of philosophical terms,2021,4,0,0,7377c27d6c0813ab580155960891dd01b97beb28,,0,0,0,0,0,0,0,2,1,1,0,概率统计与推理基础
KILT: a Benchmark for Knowledge Intensive Language Tasks,2021,691,269,6,3af229f3da1bd24378fd8d76c88fd393b4464058,,0,0,0,0,0,0,15,77,110,145,170,自然语言处理
A Survey on Recent Approaches for Natural Language Processing in Low-Resource Scenarios,2021,341,73,14,455cdafd55a5b5ddefa029bf97801327e142646d,,0,0,0,0,0,0,2,33,68,76,87,自然语言处理
Temporal Knowledge Graph Completion using a Linear Temporal Regularizer and Multivector Embeddings,2021,102,32,1,e467b66fd3505e8ea0d1f0c61df6ea832858fe1f,,0,0,0,0,0,0,1,3,20,22,35,表示学习与优化方法
UDALM: Unsupervised Domain Adaptation through Language Modeling,2021,60,22,4,a4f1baae8aa410c01fb04bf9107e0f03196c8241,,0,0,0,0,0,0,0,3,20,17,12,自然语言处理
Beyond Black & White: Leveraging Annotator Disagreement via Soft-Label Multi-Task Learning,2021,124,46,1,329922df03bf67500f8860e8cbc87bbe7a1ee54b,,0,0,0,0,0,0,0,16,27,32,27,模型可解释性、公平性、应用系统等
Clustering-based Inference for Biomedical Entity Linking,2021,54,20,0,96079beb0b00ef64d753fbc5f6e2e4e58345b790,,0,0,0,0,0,0,1,7,14,17,11,自然语言处理
Variance-reduced First-order Meta-learning for Natural Language Processing Tasks,2021,9,6,0,5b89435357806e89cd428c56ce98aeb930b0df5c,,0,0,0,0,0,0,0,2,3,2,2,机器学习（含深度学习）
Diversity-Aware Batch Active Learning for Dependency Parsing,2021,12,6,0,364b50c19cc1a8e2347d555a4c60802965f75670,,0,0,0,0,0,0,0,1,2,5,0,自然语言处理
How many data points is a prompt worth?,2021,317,126,8,a9fe5bd8da2d9603cf2cf6c6ea8b0f83c6d3a4f9,,0,0,0,0,0,0,2,53,107,68,55,自然语言处理
Can Latent Alignments Improve Autoregressive Machine Translation?,2021,5,2,0,69278ea9200ec76d6da51058afcdd2ee803f75c4,,0,0,0,0,0,0,0,1,3,0,1,自然语言处理
Smoothing and Shrinking the Sparse Seq2Seq Search Space,2021,17,6,0,1e6171d9937a36b2dba6b622bd5857f2407d1b2e,,0,0,0,0,0,0,0,5,5,2,4,自然语言处理
Unified Pre-training for Program Understanding and Generation,2021,851,204,15,0646bb09db4d1ba24150e69b71edcd4aff691b3c,,0,0,0,0,0,0,0,39,142,291,221,自然语言处理
Hyperparameter-free Continuous Learning for Domain Classification in Natural Language Understanding,2021,5,1,1,ea2f2fa4a7336d0d99dafe912ed43538d29da09b,,0,0,0,0,0,0,0,0,2,1,1,自然语言处理
On the Embeddings of Variables in Recurrent Neural Networks for Source Code,2021,4,1,0,93224a853ae284c15211998ecb5b295d70486d27,,0,0,0,0,0,0,0,0,0,3,1,表示学习与优化方法
Cross-Lingual Word Embedding Refinement by \ell₁ Norm Optimisation,2021,14,6,0,17fa1a5a4b12eb312a6f3f069e013d644708e437,,0,0,0,0,0,0,1,0,4,3,5,自然语言处理
Semantic Frame Forecast,2021,5,1,0,38cd1136bf2630f5d2e3d62638ee8726eb672e79,,0,0,0,0,0,0,0,0,3,2,0,自然语言处理
MUSER: MUltimodal Stress detection using Emotion Recognition as an Auxiliary Task,2021,21,2,1,de57428068ef955924172e9d2b8008981dac6eab,,0,0,0,0,0,0,0,0,5,4,4,多模态学习
Learning to Decompose and Organize Complex Tasks,2021,38,12,0,c58269be7bb0b7c896e5d74bfdcfb023c6787cf6,,0,0,0,0,0,0,0,5,8,11,5,基础 AI 理论
Continual Learning for Text Classification with Information Disentanglement Based Regularization,2021,124,47,3,677a7a940dcff639bd066f25b395a361a08a60f9,,0,0,0,0,0,0,0,8,24,30,33,机器学习（含深度学习）
Learning from Executions for Semantic Parsing,2021,12,8,0,f825431db6e83c1ba3f485f2030682755325ccef,,0,0,0,0,0,0,0,2,4,2,1,自然语言处理
Learning to Synthesize Data for Semantic Parsing,2021,55,23,0,afd8fb26a7094ed3a8838000d50e2b22f815dc28,,0,0,0,0,0,0,0,14,19,8,6,自然语言处理
Edge: Enriching Knowledge Graph Embeddings with External Text,2021,36,8,1,182f055c40bfcff45d0ce6eb68e2d8684d0931dc,,0,0,0,0,0,0,0,5,9,10,4,表示学习与优化方法
